{
  "id": "vocab-11",
  "title": "أجزاء الجسم",
  "title_en": "Body Parts",
  "level": "A1",
  "theme": "body",
  "description_ar": "أهم أجزاء الجسم وأعضائه.",
  "words": [
    { "en": "Body", "ar": "جسم", "ipa": "/ˈbɑː.di/", "pos": "noun", "example_en": "Take care of your body.", "example_ar": "اعتنِ بجسمك." },
    { "en": "Head", "ar": "رأس", "ipa": "/hed/", "pos": "noun", "example_en": "My head hurts.", "example_ar": "رأسي يؤلمني." },
    { "en": "Hair", "ar": "شعر", "ipa": "/her/", "pos": "noun", "example_en": "She has long hair.", "example_ar": "لديها شعر طويل." },
    { "en": "Neck", "ar": "رقبة", "ipa": "/nek/", "pos": "noun", "example_en": "My neck is stiff.", "example_ar": "رقبتي متيبسة." },
    { "en": "Shoulder", "ar": "كتف", "ipa": "/ˈʃoʊl.dər/", "pos": "noun", "example_en": "My shoulder hurts.", "example_ar": "كتفي يؤلمني." },
    { "en": "Arm", "ar": "ذراع", "ipa": "/ɑːrm/", "pos": "noun", "example_en": "He broke his arm.", "example_ar": "كسر ذراعه." },
    { "en": "Hand", "ar": "يد", "ipa": "/hænd/", "pos": "noun", "example_en": "Wash your hands.", "example_ar": "اغسل يديك." },
    { "en": "Finger", "ar": "إصبع", "ipa": "/ˈfɪŋ.ɡər/", "pos": "noun", "example_en": "I cut my finger.", "example_ar": "جرحت إصبعي." },
    { "en": "Leg", "ar": "ساق", "ipa": "/leɡ/", "pos": "noun", "example_en": "My leg is tired.", "example_ar": "ساقي متعبة." },
    { "en": "Knee", "ar": "ركبة", "ipa": "/niː/", "pos": "noun", "example_en": "I hurt my knee.", "example_ar": "آذيت ركبتي." },
    { "en": "Foot", "ar": "قدم", "ipa": "/fʊt/", "pos": "noun", "example_en": "My foot hurts.", "example_ar": "قدمي تؤلمني." },
    { "en": "Toe", "ar": "إصبع القدم", "ipa": "/toʊ/", "pos": "noun", "example_en": "I have ten toes.", "example_ar": "لدي عشرة أصابع قدم." },
    { "en": "Back", "ar": "ظهر", "ipa": "/bæk/", "pos": "noun", "example_en": "My back hurts.", "example_ar": "ظهري يؤلمني." },
    { "en": "Chest", "ar": "صدر", "ipa": "/tʃest/", "pos": "noun", "example_en": "Chest pain.", "example_ar": "ألم في الصدر." },
    { "en": "Stomach", "ar": "معدة / بطن", "ipa": "/ˈstʌm.ək/", "pos": "noun", "example_en": "My stomach hurts.", "example_ar": "معدتي تؤلمني." },
    { "en": "Heart", "ar": "قلب", "ipa": "/hɑːrt/", "pos": "noun", "example_en": "My heart beats fast.", "example_ar": "قلبي ينبض بسرعة." },
    { "en": "Skin", "ar": "جلد", "ipa": "/skɪn/", "pos": "noun", "example_en": "Soft skin.", "example_ar": "جلد ناعم." },
    { "en": "Bone", "ar": "عظم", "ipa": "/boʊn/", "pos": "noun", "example_en": "He broke a bone.", "example_ar": "كسر عظماً." },
    { "en": "Blood", "ar": "دم", "ipa": "/blʌd/", "pos": "noun", "example_en": "He gave blood.", "example_ar": "تبرّع بالدم." },
    { "en": "Muscle", "ar": "عضلة", "ipa": "/ˈmʌs.əl/", "pos": "noun", "example_en": "Strong muscles.", "example_ar": "عضلات قوية." },
    { "en": "Wrist", "ar": "معصم", "ipa": "/rɪst/", "pos": "noun", "example_en": "I wear a watch on my wrist.", "example_ar": "أرتدي ساعة في معصمي." },
    { "en": "Elbow", "ar": "كوع", "ipa": "/ˈel.boʊ/", "pos": "noun", "example_en": "Bend your elbow.", "example_ar": "اثنِ كوعك." },
    { "en": "Ankle", "ar": "كاحل", "ipa": "/ˈæŋ.kəl/", "pos": "noun", "example_en": "I twisted my ankle.", "example_ar": "التويت كاحلي." },
    { "en": "Thumb", "ar": "إبهام", "ipa": "/θʌm/", "pos": "noun", "example_en": "Thumbs up!", "example_ar": "أحسنت!" },
    { "en": "Nail", "ar": "ظفر", "ipa": "/neɪl/", "pos": "noun", "example_en": "Long nails.", "example_ar": "أظافر طويلة." }
  ]
}
