{
  "id": "vocab-16",
  "title": "المشروبات",
  "title_en": "Drinks",
  "level": "A1",
  "theme": "food",
  "description_ar": "المشروبات الساخنة والباردة.",
  "words": [
    { "en": "Drink", "ar": "مشروب", "ipa": "/drɪŋk/", "pos": "noun", "example_en": "A cold drink.", "example_ar": "مشروب بارد." },
    { "en": "Water", "ar": "ماء", "ipa": "/ˈwɔː.t̬ər/", "pos": "noun", "example_en": "I need water.", "example_ar": "أحتاج ماء." },
    { "en": "Coffee", "ar": "قهوة", "ipa": "/ˈkɔː.fi/", "pos": "noun", "example_en": "Black coffee.", "example_ar": "قهوة سادة." },
    { "en": "Tea", "ar": "شاي", "ipa": "/tiː/", "pos": "noun", "example_en": "Hot tea.", "example_ar": "شاي ساخن." },
    { "en": "Juice", "ar": "عصير", "ipa": "/dʒuːs/", "pos": "noun", "example_en": "Apple juice.", "example_ar": "عصير تفاح." },
    { "en": "Soda", "ar": "مشروب غازي", "ipa": "/ˈsoʊ.də/", "pos": "noun", "example_en": "Cold soda.", "example_ar": "مشروب غازي بارد." },
    { "en": "Lemonade", "ar": "ليموناضة", "ipa": "/ˌlem.əˈneɪd/", "pos": "noun", "example_en": "Fresh lemonade.", "example_ar": "ليموناضة طازجة." },
    { "en": "Milk", "ar": "حليب", "ipa": "/mɪlk/", "pos": "noun", "example_en": "Warm milk.", "example_ar": "حليب دافئ." },
    { "en": "Smoothie", "ar": "سموثي", "ipa": "/ˈsmuː.ði/", "pos": "noun", "example_en": "Banana smoothie.", "example_ar": "سموثي موز." },
    { "en": "Ice", "ar": "ثلج", "ipa": "/aɪs/", "pos": "noun", "example_en": "With ice, please.", "example_ar": "مع ثلج، من فضلك." },
    { "en": "Cup", "ar": "كوب", "ipa": "/kʌp/", "pos": "noun", "example_en": "A cup of tea.", "example_ar": "كوب شاي." },
    { "en": "Glass", "ar": "كأس", "ipa": "/ɡlæs/", "pos": "noun", "example_en": "A glass of water.", "example_ar": "كأس ماء." },
    { "en": "Bottle", "ar": "زجاجة", "ipa": "/ˈbɑː.t̬əl/", "pos": "noun", "example_en": "A water bottle.", "example_ar": "زجاجة ماء." },
    { "en": "Straw", "ar": "ماصة", "ipa": "/strɔː/", "pos": "noun", "example_en": "Use a straw.", "example_ar": "استخدم ماصة." },
    { "en": "Hot chocolate", "ar": "شوكولاتة ساخنة", "ipa": "/hɑːt ˈtʃɑːk.lət/", "pos": "noun", "example_en": "Sweet hot chocolate.", "example_ar": "شوكولاتة ساخنة حلوة." },
    { "en": "Espresso", "ar": "اسبريسو", "ipa": "/esˈpres.oʊ/", "pos": "noun", "example_en": "Strong espresso.", "example_ar": "اسبريسو قوي." },
    { "en": "Latte", "ar": "لاتيه", "ipa": "/ˈlɑː.teɪ/", "pos": "noun", "example_en": "A vanilla latte.", "example_ar": "لاتيه بالفانيليا." },
    { "en": "Sip", "ar": "رشفة", "ipa": "/sɪp/", "pos": "noun", "example_en": "Take a sip.", "example_ar": "خذ رشفة." },
    { "en": "Refill", "ar": "إعادة تعبئة", "ipa": "/ˈriː.fɪl/", "pos": "noun", "example_en": "Free refill.", "example_ar": "إعادة تعبئة مجانية." },
    { "en": "Boiling", "ar": "غليان", "ipa": "/ˈbɔɪ.lɪŋ/", "pos": "adjective", "example_en": "Boiling water.", "example_ar": "ماء يغلي." },
    { "en": "Cold drink", "ar": "مشروب بارد", "ipa": "/koʊld drɪŋk/", "pos": "phrase", "example_en": "I want a cold drink.", "example_ar": "أريد مشروباً بارداً." },
    { "en": "Mint", "ar": "نعناع", "ipa": "/mɪnt/", "pos": "noun", "example_en": "Mint tea.", "example_ar": "شاي نعناع." },
    { "en": "Sweet", "ar": "حلو", "ipa": "/swiːt/", "pos": "adjective", "example_en": "Too sweet.", "example_ar": "حلو جداً." },
    { "en": "Bitter", "ar": "مر", "ipa": "/ˈbɪt̬.ər/", "pos": "adjective", "example_en": "Bitter coffee.", "example_ar": "قهوة مرة." },
    { "en": "Tasty", "ar": "لذيذ", "ipa": "/ˈteɪ.sti/", "pos": "adjective", "example_en": "Very tasty!", "example_ar": "لذيذ جداً!" }
  ]
}
