{
  "id": "vocab-37",
  "title": "الرياضة والهوايات",
  "title_en": "Sports & Hobbies",
  "level": "A1",
  "theme": "sports",
  "description_ar": "الرياضات الشائعة والهوايات.",
  "words": [
    { "en": "Sport", "ar": "رياضة", "ipa": "/spɔːrt/", "pos": "noun", "example_en": "Sport is fun.", "example_ar": "الرياضة ممتعة." },
    { "en": "Football", "ar": "كرة قدم", "ipa": "/ˈfʊt.bɔːl/", "pos": "noun", "example_en": "Play football.", "example_ar": "العب كرة قدم." },
    { "en": "Basketball", "ar": "كرة سلة", "ipa": "/ˈbæs.kɪt.bɔːl/", "pos": "noun", "example_en": "Basketball team.", "example_ar": "فريق كرة سلة." },
    { "en": "Tennis", "ar": "تنس", "ipa": "/ˈten.ɪs/", "pos": "noun", "example_en": "Play tennis.", "example_ar": "العب تنس." },
    { "en": "Swimming", "ar": "سباحة", "ipa": "/ˈswɪm.ɪŋ/", "pos": "noun", "example_en": "Go swimming.", "example_ar": "اذهب للسباحة." },
    { "en": "Running", "ar": "جري", "ipa": "/ˈrʌn.ɪŋ/", "pos": "noun", "example_en": "Morning running.", "example_ar": "جري الصباح." },
    { "en": "Cycling", "ar": "ركوب الدراجة", "ipa": "/ˈsaɪ.klɪŋ/", "pos": "noun", "example_en": "Enjoy cycling.", "example_ar": "استمتع بركوب الدراجة." },
    { "en": "Yoga", "ar": "يوغا", "ipa": "/ˈjoʊ.ɡə/", "pos": "noun", "example_en": "Practice yoga.", "example_ar": "مارس اليوغا." },
    { "en": "Gym", "ar": "صالة رياضية", "ipa": "/dʒɪm/", "pos": "noun", "example_en": "Go to the gym.", "example_ar": "اذهب للصالة الرياضية." },
    { "en": "Team", "ar": "فريق", "ipa": "/tiːm/", "pos": "noun", "example_en": "Winning team.", "example_ar": "الفريق الفائز." },
    { "en": "Player", "ar": "لاعب", "ipa": "/ˈpleɪ.ər/", "pos": "noun", "example_en": "Best player.", "example_ar": "أفضل لاعب." },
    { "en": "Game", "ar": "مباراة / لعبة", "ipa": "/ɡeɪm/", "pos": "noun", "example_en": "Big game tonight.", "example_ar": "مباراة كبيرة الليلة." },
    { "en": "Ball", "ar": "كرة", "ipa": "/bɔːl/", "pos": "noun", "example_en": "Kick the ball.", "example_ar": "اركل الكرة." },
    { "en": "Goal", "ar": "هدف", "ipa": "/ɡoʊl/", "pos": "noun", "example_en": "Score a goal!", "example_ar": "سجل هدفاً!" },
    { "en": "Win", "ar": "يفوز", "ipa": "/wɪn/", "pos": "verb", "example_en": "We will win.", "example_ar": "سوف نفوز." },
    { "en": "Lose", "ar": "يخسر", "ipa": "/luːz/", "pos": "verb", "example_en": "Don't lose hope.", "example_ar": "لا تفقد الأمل." },
    { "en": "Hobby", "ar": "هواية", "ipa": "/ˈhɑː.bi/", "pos": "noun", "example_en": "My hobby is reading.", "example_ar": "هوايتي القراءة." },
    { "en": "Music", "ar": "موسيقى", "ipa": "/ˈmjuː.zɪk/", "pos": "noun", "example_en": "Listen to music.", "example_ar": "استمع للموسيقى." },
    { "en": "Dance", "ar": "رقص", "ipa": "/dæns/", "pos": "noun", "example_en": "Dance class.", "example_ar": "حصة رقص." },
    { "en": "Painting", "ar": "رسم", "ipa": "/ˈpeɪn.t̬ɪŋ/", "pos": "noun", "example_en": "I love painting.", "example_ar": "أحب الرسم." },
    { "en": "Reading", "ar": "قراءة", "ipa": "/ˈriː.dɪŋ/", "pos": "noun", "example_en": "Reading is fun.", "example_ar": "القراءة ممتعة." },
    { "en": "Cooking", "ar": "طبخ", "ipa": "/ˈkʊk.ɪŋ/", "pos": "noun", "example_en": "Cooking is creative.", "example_ar": "الطبخ إبداع." },
    { "en": "Photography", "ar": "تصوير فوتوغرافي", "ipa": "/fəˈtɑː.ɡrə.fi/", "pos": "noun", "example_en": "Wildlife photography.", "example_ar": "تصوير الحياة البرية." },
    { "en": "Gardening", "ar": "بستنة", "ipa": "/ˈɡɑːr.dən.ɪŋ/", "pos": "noun", "example_en": "I enjoy gardening.", "example_ar": "أستمتع بالبستنة." },
    { "en": "Chess", "ar": "شطرنج", "ipa": "/tʃes/", "pos": "noun", "example_en": "Play chess.", "example_ar": "العب شطرنج." }
  ]
}
