{
  "id": "vocab-19",
  "title": "أدوات المطبخ",
  "title_en": "Kitchen Items",
  "level": "A1",
  "theme": "home",
  "description_ar": "أدوات وأواني المطبخ.",
  "words": [
    { "en": "Plate", "ar": "طبق", "ipa": "/pleɪt/", "pos": "noun", "example_en": "A clean plate.", "example_ar": "طبق نظيف." },
    { "en": "Bowl", "ar": "وعاء", "ipa": "/boʊl/", "pos": "noun", "example_en": "A bowl of soup.", "example_ar": "وعاء حساء." },
    { "en": "Cup", "ar": "كوب", "ipa": "/kʌp/", "pos": "noun", "example_en": "Coffee cup.", "example_ar": "كوب قهوة." },
    { "en": "Mug", "ar": "كوب كبير", "ipa": "/mʌɡ/", "pos": "noun", "example_en": "Tea mug.", "example_ar": "كوب شاي كبير." },
    { "en": "Spoon", "ar": "ملعقة", "ipa": "/spuːn/", "pos": "noun", "example_en": "A silver spoon.", "example_ar": "ملعقة فضية." },
    { "en": "Fork", "ar": "شوكة", "ipa": "/fɔːrk/", "pos": "noun", "example_en": "Use a fork.", "example_ar": "استخدم الشوكة." },
    { "en": "Knife", "ar": "سكين", "ipa": "/naɪf/", "pos": "noun", "example_en": "A sharp knife.", "example_ar": "سكين حادة." },
    { "en": "Napkin", "ar": "منديل", "ipa": "/ˈnæp.kɪn/", "pos": "noun", "example_en": "A paper napkin.", "example_ar": "منديل ورقي." },
    { "en": "Pot", "ar": "قدر", "ipa": "/pɑːt/", "pos": "noun", "example_en": "A big pot.", "example_ar": "قدر كبير." },
    { "en": "Pan", "ar": "مقلاة", "ipa": "/pæn/", "pos": "noun", "example_en": "A frying pan.", "example_ar": "مقلاة." },
    { "en": "Stove", "ar": "موقد", "ipa": "/stoʊv/", "pos": "noun", "example_en": "Gas stove.", "example_ar": "موقد غاز." },
    { "en": "Oven", "ar": "فرن", "ipa": "/ˈʌv.ən/", "pos": "noun", "example_en": "Hot oven.", "example_ar": "فرن ساخن." },
    { "en": "Microwave", "ar": "ميكروويف", "ipa": "/ˈmaɪ.kroʊ.weɪv/", "pos": "noun", "example_en": "Microwave the food.", "example_ar": "سخن الطعام بالميكروويف." },
    { "en": "Fridge", "ar": "ثلاجة", "ipa": "/frɪdʒ/", "pos": "noun", "example_en": "Open the fridge.", "example_ar": "افتح الثلاجة." },
    { "en": "Freezer", "ar": "مجمّد", "ipa": "/ˈfriː.zər/", "pos": "noun", "example_en": "Ice in the freezer.", "example_ar": "ثلج في المجمد." },
    { "en": "Sink", "ar": "حوض", "ipa": "/sɪŋk/", "pos": "noun", "example_en": "Wash in the sink.", "example_ar": "اغسل في الحوض." },
    { "en": "Faucet", "ar": "صنبور", "ipa": "/ˈfɔː.sɪt/", "pos": "noun", "example_en": "The faucet is leaking.", "example_ar": "الصنبور يسرّب." },
    { "en": "Cabinet", "ar": "خزانة مطبخ", "ipa": "/ˈkæb.ɪ.nət/", "pos": "noun", "example_en": "Kitchen cabinet.", "example_ar": "خزانة مطبخ." },
    { "en": "Cup of tea", "ar": "كوب شاي", "ipa": "/kʌp əv tiː/", "pos": "phrase", "example_en": "Have a cup of tea.", "example_ar": "تناول كوب شاي." },
    { "en": "Kettle", "ar": "غلاية", "ipa": "/ˈket̬.əl/", "pos": "noun", "example_en": "Boil the kettle.", "example_ar": "اغلِ الماء في الغلاية." },
    { "en": "Toaster", "ar": "محمصة خبز", "ipa": "/ˈtoʊ.stər/", "pos": "noun", "example_en": "Use the toaster.", "example_ar": "استخدم المحمصة." },
    { "en": "Blender", "ar": "خلاط", "ipa": "/ˈblen.dər/", "pos": "noun", "example_en": "Blend in the blender.", "example_ar": "اخلط في الخلاط." },
    { "en": "Dish", "ar": "صحن", "ipa": "/dɪʃ/", "pos": "noun", "example_en": "Wash the dishes.", "example_ar": "اغسل الصحون." },
    { "en": "Tray", "ar": "صينية", "ipa": "/treɪ/", "pos": "noun", "example_en": "A serving tray.", "example_ar": "صينية تقديم." },
    { "en": "Apron", "ar": "مريول", "ipa": "/ˈeɪ.prən/", "pos": "noun", "example_en": "Wear an apron.", "example_ar": "ارتدِ مريولاً." }
  ]
}
