{
  "id": "vocab-06",
  "title": "الألوان",
  "title_en": "Colors",
  "level": "A1",
  "theme": "colors",
  "description_ar": "أهم الألوان الأساسية والثانوية.",
  "words": [
    { "en": "Color", "ar": "لون", "ipa": "/ˈkʌl.ər/", "pos": "noun", "example_en": "What's your favorite color?", "example_ar": "ما لونك المفضل؟" },
    { "en": "Red", "ar": "أحمر", "ipa": "/red/", "pos": "adjective", "example_en": "I love red roses.", "example_ar": "أحب الورد الأحمر." },
    { "en": "Blue", "ar": "أزرق", "ipa": "/bluː/", "pos": "adjective", "example_en": "The sky is blue.", "example_ar": "السماء زرقاء." },
    { "en": "Green", "ar": "أخضر", "ipa": "/ɡriːn/", "pos": "adjective", "example_en": "Grass is green.", "example_ar": "العشب أخضر." },
    { "en": "Yellow", "ar": "أصفر", "ipa": "/ˈjel.oʊ/", "pos": "adjective", "example_en": "The sun is yellow.", "example_ar": "الشمس صفراء." },
    { "en": "Orange", "ar": "برتقالي", "ipa": "/ˈɔːr.ɪndʒ/", "pos": "adjective", "example_en": "Orange juice, please.", "example_ar": "عصير برتقال من فضلك." },
    { "en": "Pink", "ar": "وردي", "ipa": "/pɪŋk/", "pos": "adjective", "example_en": "She wears a pink dress.", "example_ar": "ترتدي فستاناً وردياً." },
    { "en": "Purple", "ar": "بنفسجي", "ipa": "/ˈpɜːr.pəl/", "pos": "adjective", "example_en": "I like purple flowers.", "example_ar": "أحب الزهور البنفسجية." },
    { "en": "Brown", "ar": "بني", "ipa": "/braʊn/", "pos": "adjective", "example_en": "Brown shoes.", "example_ar": "أحذية بنية." },
    { "en": "Black", "ar": "أسود", "ipa": "/blæk/", "pos": "adjective", "example_en": "A black cat.", "example_ar": "قطة سوداء." },
    { "en": "White", "ar": "أبيض", "ipa": "/waɪt/", "pos": "adjective", "example_en": "A white shirt.", "example_ar": "قميص أبيض." },
    { "en": "Gray", "ar": "رمادي", "ipa": "/ɡreɪ/", "pos": "adjective", "example_en": "A gray cloud.", "example_ar": "غيمة رمادية." },
    { "en": "Gold", "ar": "ذهبي", "ipa": "/ɡoʊld/", "pos": "adjective", "example_en": "A gold ring.", "example_ar": "خاتم ذهبي." },
    { "en": "Silver", "ar": "فضي", "ipa": "/ˈsɪl.vər/", "pos": "adjective", "example_en": "A silver watch.", "example_ar": "ساعة فضية." },
    { "en": "Light", "ar": "فاتح", "ipa": "/laɪt/", "pos": "adjective", "example_en": "Light blue walls.", "example_ar": "جدران زرقاء فاتحة." },
    { "en": "Dark", "ar": "غامق", "ipa": "/dɑːrk/", "pos": "adjective", "example_en": "Dark green leaves.", "example_ar": "أوراق خضراء غامقة." },
    { "en": "Bright", "ar": "ساطع", "ipa": "/braɪt/", "pos": "adjective", "example_en": "A bright yellow.", "example_ar": "أصفر ساطع." },
    { "en": "Pale", "ar": "شاحب", "ipa": "/peɪl/", "pos": "adjective", "example_en": "Pale pink.", "example_ar": "وردي شاحب." },
    { "en": "Beige", "ar": "بيج", "ipa": "/beɪʒ/", "pos": "adjective", "example_en": "A beige sofa.", "example_ar": "أريكة بيج." },
    { "en": "Navy", "ar": "كحلي", "ipa": "/ˈneɪ.vi/", "pos": "adjective", "example_en": "A navy suit.", "example_ar": "بدلة كحلية." },
    { "en": "Turquoise", "ar": "فيروزي", "ipa": "/ˈtɜːr.kwɔɪz/", "pos": "adjective", "example_en": "Turquoise water.", "example_ar": "مياه فيروزية." },
    { "en": "Rainbow", "ar": "قوس قزح", "ipa": "/ˈreɪn.boʊ/", "pos": "noun", "example_en": "I see a rainbow.", "example_ar": "أرى قوس قزح." },
    { "en": "Paint", "ar": "طلاء", "ipa": "/peɪnt/", "pos": "noun", "example_en": "We need more paint.", "example_ar": "نحتاج المزيد من الطلاء." },
    { "en": "Shade", "ar": "درجة لونية", "ipa": "/ʃeɪd/", "pos": "noun", "example_en": "A lighter shade of blue.", "example_ar": "درجة أفتح من الأزرق." },
    { "en": "Colorful", "ar": "ملوّن", "ipa": "/ˈkʌl.ər.fəl/", "pos": "adjective", "example_en": "A colorful painting.", "example_ar": "لوحة ملونة." }
  ]
}
