{
  "id": "vocab-09",
  "title": "صفات الحجم والكمية والجودة",
  "title_en": "Size, Quantity & Quality Adjectives",
  "level": "A1",
  "theme": "adjectives",
  "description_ar": "أهم الصفات لوصف الأشياء.",
  "words": [
    { "en": "Big", "ar": "كبير", "ipa": "/bɪɡ/", "pos": "adjective", "example_en": "A big house.", "example_ar": "بيت كبير." },
    { "en": "Small", "ar": "صغير", "ipa": "/smɔːl/", "pos": "adjective", "example_en": "A small dog.", "example_ar": "كلب صغير." },
    { "en": "Long", "ar": "طويل", "ipa": "/lɔːŋ/", "pos": "adjective", "example_en": "A long road.", "example_ar": "طريق طويل." },
    { "en": "Short", "ar": "قصير", "ipa": "/ʃɔːrt/", "pos": "adjective", "example_en": "A short letter.", "example_ar": "رسالة قصيرة." },
    { "en": "Tall", "ar": "طويل القامة", "ipa": "/tɔːl/", "pos": "adjective", "example_en": "He is very tall.", "example_ar": "هو طويل القامة جداً." },
    { "en": "High", "ar": "مرتفع", "ipa": "/haɪ/", "pos": "adjective", "example_en": "A high mountain.", "example_ar": "جبل مرتفع." },
    { "en": "Low", "ar": "منخفض", "ipa": "/loʊ/", "pos": "adjective", "example_en": "A low chair.", "example_ar": "كرسي منخفض." },
    { "en": "Wide", "ar": "واسع", "ipa": "/waɪd/", "pos": "adjective", "example_en": "A wide street.", "example_ar": "شارع واسع." },
    { "en": "Narrow", "ar": "ضيق", "ipa": "/ˈner.oʊ/", "pos": "adjective", "example_en": "A narrow path.", "example_ar": "ممر ضيق." },
    { "en": "Heavy", "ar": "ثقيل", "ipa": "/ˈhev.i/", "pos": "adjective", "example_en": "A heavy bag.", "example_ar": "حقيبة ثقيلة." },
    { "en": "Light", "ar": "خفيف", "ipa": "/laɪt/", "pos": "adjective", "example_en": "A light box.", "example_ar": "صندوق خفيف." },
    { "en": "Fast", "ar": "سريع", "ipa": "/fæst/", "pos": "adjective", "example_en": "A fast car.", "example_ar": "سيارة سريعة." },
    { "en": "Slow", "ar": "بطيء", "ipa": "/sloʊ/", "pos": "adjective", "example_en": "A slow turtle.", "example_ar": "سلحفاة بطيئة." },
    { "en": "New", "ar": "جديد", "ipa": "/nuː/", "pos": "adjective", "example_en": "A new phone.", "example_ar": "هاتف جديد." },
    { "en": "Old", "ar": "قديم / كبير السن", "ipa": "/oʊld/", "pos": "adjective", "example_en": "An old book.", "example_ar": "كتاب قديم." },
    { "en": "Young", "ar": "صغير السن", "ipa": "/jʌŋ/", "pos": "adjective", "example_en": "A young boy.", "example_ar": "فتى صغير." },
    { "en": "Good", "ar": "جيد", "ipa": "/ɡʊd/", "pos": "adjective", "example_en": "A good idea.", "example_ar": "فكرة جيدة." },
    { "en": "Bad", "ar": "سيء", "ipa": "/bæd/", "pos": "adjective", "example_en": "Bad weather.", "example_ar": "طقس سيء." },
    { "en": "Easy", "ar": "سهل", "ipa": "/ˈiː.zi/", "pos": "adjective", "example_en": "An easy test.", "example_ar": "اختبار سهل." },
    { "en": "Hard", "ar": "صعب", "ipa": "/hɑːrd/", "pos": "adjective", "example_en": "Hard work.", "example_ar": "عمل صعب." },
    { "en": "Hot", "ar": "حار", "ipa": "/hɑːt/", "pos": "adjective", "example_en": "Hot coffee.", "example_ar": "قهوة حارة." },
    { "en": "Cold", "ar": "بارد", "ipa": "/koʊld/", "pos": "adjective", "example_en": "Cold water.", "example_ar": "ماء بارد." },
    { "en": "Beautiful", "ar": "جميل", "ipa": "/ˈbjuː.t̬ə.fəl/", "pos": "adjective", "example_en": "A beautiful view.", "example_ar": "منظر جميل." },
    { "en": "Ugly", "ar": "قبيح", "ipa": "/ˈʌɡ.li/", "pos": "adjective", "example_en": "An ugly painting.", "example_ar": "لوحة قبيحة." },
    { "en": "Cheap", "ar": "رخيص", "ipa": "/tʃiːp/", "pos": "adjective", "example_en": "A cheap ticket.", "example_ar": "تذكرة رخيصة." }
  ]
}
