{
  "id": "vocab-07",
  "title": "أيام الأسبوع والشهور",
  "title_en": "Days & Months",
  "level": "A1",
  "theme": "time",
  "description_ar": "أيام الأسبوع وشهور السنة وكلمات التوقيت.",
  "words": [
    { "en": "Sunday", "ar": "الأحد", "ipa": "/ˈsʌn.deɪ/", "pos": "noun", "example_en": "I rest on Sunday.", "example_ar": "أرتاح يوم الأحد." },
    { "en": "Monday", "ar": "الإثنين", "ipa": "/ˈmʌn.deɪ/", "pos": "noun", "example_en": "School starts Monday.", "example_ar": "المدرسة تبدأ الإثنين." },
    { "en": "Tuesday", "ar": "الثلاثاء", "ipa": "/ˈtuːz.deɪ/", "pos": "noun", "example_en": "I have a class Tuesday.", "example_ar": "لدي حصة الثلاثاء." },
    { "en": "Wednesday", "ar": "الأربعاء", "ipa": "/ˈwenz.deɪ/", "pos": "noun", "example_en": "See you Wednesday.", "example_ar": "أراك الأربعاء." },
    { "en": "Thursday", "ar": "الخميس", "ipa": "/ˈθɜːrz.deɪ/", "pos": "noun", "example_en": "Thursday is busy.", "example_ar": "الخميس مزدحم." },
    { "en": "Friday", "ar": "الجمعة", "ipa": "/ˈfraɪ.deɪ/", "pos": "noun", "example_en": "Friday is my favorite day.", "example_ar": "الجمعة يومي المفضل." },
    { "en": "Saturday", "ar": "السبت", "ipa": "/ˈsæt̬.ər.deɪ/", "pos": "noun", "example_en": "We meet on Saturday.", "example_ar": "نلتقي يوم السبت." },
    { "en": "Week", "ar": "أسبوع", "ipa": "/wiːk/", "pos": "noun", "example_en": "See you next week.", "example_ar": "أراك الأسبوع القادم." },
    { "en": "Weekend", "ar": "عطلة نهاية الأسبوع", "ipa": "/ˈwiːk.end/", "pos": "noun", "example_en": "Enjoy your weekend!", "example_ar": "استمتع بعطلة نهاية الأسبوع!" },
    { "en": "Day", "ar": "يوم", "ipa": "/deɪ/", "pos": "noun", "example_en": "Have a good day.", "example_ar": "أتمنى لك يوماً سعيداً." },
    { "en": "January", "ar": "يناير", "ipa": "/ˈdʒæn.ju.er.i/", "pos": "noun", "example_en": "January is cold.", "example_ar": "يناير بارد." },
    { "en": "February", "ar": "فبراير", "ipa": "/ˈfeb.ru.er.i/", "pos": "noun", "example_en": "Valentine's is in February.", "example_ar": "عيد الحب في فبراير." },
    { "en": "March", "ar": "مارس", "ipa": "/mɑːrtʃ/", "pos": "noun", "example_en": "Spring starts in March.", "example_ar": "الربيع يبدأ في مارس." },
    { "en": "April", "ar": "أبريل", "ipa": "/ˈeɪ.prəl/", "pos": "noun", "example_en": "April showers.", "example_ar": "أمطار أبريل." },
    { "en": "May", "ar": "مايو", "ipa": "/meɪ/", "pos": "noun", "example_en": "Flowers bloom in May.", "example_ar": "تتفتح الأزهار في مايو." },
    { "en": "June", "ar": "يونيو", "ipa": "/dʒuːn/", "pos": "noun", "example_en": "School ends in June.", "example_ar": "تنتهي المدرسة في يونيو." },
    { "en": "July", "ar": "يوليو", "ipa": "/dʒuˈlaɪ/", "pos": "noun", "example_en": "July is very hot.", "example_ar": "يوليو حار جداً." },
    { "en": "August", "ar": "أغسطس", "ipa": "/ˈɔː.ɡəst/", "pos": "noun", "example_en": "I travel in August.", "example_ar": "أسافر في أغسطس." },
    { "en": "September", "ar": "سبتمبر", "ipa": "/sepˈtem.bər/", "pos": "noun", "example_en": "School starts in September.", "example_ar": "المدرسة تبدأ في سبتمبر." },
    { "en": "October", "ar": "أكتوبر", "ipa": "/ɑːkˈtoʊ.bər/", "pos": "noun", "example_en": "Leaves fall in October.", "example_ar": "الأوراق تتساقط في أكتوبر." },
    { "en": "November", "ar": "نوفمبر", "ipa": "/noʊˈvem.bər/", "pos": "noun", "example_en": "November is windy.", "example_ar": "نوفمبر مليء بالرياح." },
    { "en": "December", "ar": "ديسمبر", "ipa": "/dɪˈsem.bər/", "pos": "noun", "example_en": "Snow in December.", "example_ar": "ثلج في ديسمبر." },
    { "en": "Month", "ar": "شهر", "ipa": "/mʌnθ/", "pos": "noun", "example_en": "This month is busy.", "example_ar": "هذا الشهر مزدحم." },
    { "en": "Year", "ar": "سنة", "ipa": "/jɪr/", "pos": "noun", "example_en": "Happy New Year!", "example_ar": "سنة جديدة سعيدة!" },
    { "en": "Today", "ar": "اليوم", "ipa": "/təˈdeɪ/", "pos": "adverb", "example_en": "Today is Monday.", "example_ar": "اليوم الإثنين." }
  ]
}
