{
  "id": "vocab-23",
  "title": "المهن والوظائف",
  "title_en": "Jobs & Professions",
  "level": "A1",
  "theme": "work",
  "description_ar": "أهم المهن والحرف.",
  "words": [
    { "en": "Doctor", "ar": "طبيب", "ipa": "/ˈdɑːk.tər/", "pos": "noun", "example_en": "See a doctor.", "example_ar": "اذهب للطبيب." },
    { "en": "Nurse", "ar": "ممرض", "ipa": "/nɜːrs/", "pos": "noun", "example_en": "A kind nurse.", "example_ar": "ممرضة لطيفة." },
    { "en": "Teacher", "ar": "معلم", "ipa": "/ˈtiː.tʃər/", "pos": "noun", "example_en": "Math teacher.", "example_ar": "معلم رياضيات." },
    { "en": "Engineer", "ar": "مهندس", "ipa": "/ˌen.dʒɪˈnɪr/", "pos": "noun", "example_en": "Software engineer.", "example_ar": "مهندس برمجيات." },
    { "en": "Lawyer", "ar": "محامٍ", "ipa": "/ˈlɔɪ.ər/", "pos": "noun", "example_en": "A good lawyer.", "example_ar": "محامٍ بارع." },
    { "en": "Police officer", "ar": "ضابط شرطة", "ipa": "/pəˈliːs ˈɑː.fɪ.sər/", "pos": "noun", "example_en": "The police officer.", "example_ar": "ضابط الشرطة." },
    { "en": "Firefighter", "ar": "إطفائي", "ipa": "/ˈfaɪərˌfaɪ.t̬ər/", "pos": "noun", "example_en": "Brave firefighter.", "example_ar": "إطفائي شجاع." },
    { "en": "Chef", "ar": "طاهٍ", "ipa": "/ʃef/", "pos": "noun", "example_en": "Famous chef.", "example_ar": "طاهٍ مشهور." },
    { "en": "Driver", "ar": "سائق", "ipa": "/ˈdraɪ.vər/", "pos": "noun", "example_en": "Taxi driver.", "example_ar": "سائق سيارة أجرة." },
    { "en": "Farmer", "ar": "مزارع", "ipa": "/ˈfɑːr.mər/", "pos": "noun", "example_en": "A hard-working farmer.", "example_ar": "مزارع مجتهد." },
    { "en": "Artist", "ar": "فنان", "ipa": "/ˈɑːr.t̬ɪst/", "pos": "noun", "example_en": "A talented artist.", "example_ar": "فنان موهوب." },
    { "en": "Writer", "ar": "كاتب", "ipa": "/ˈraɪ.t̬ər/", "pos": "noun", "example_en": "Famous writer.", "example_ar": "كاتب مشهور." },
    { "en": "Singer", "ar": "مغني", "ipa": "/ˈsɪŋ.ər/", "pos": "noun", "example_en": "Pop singer.", "example_ar": "مغني بوب." },
    { "en": "Actor", "ar": "ممثل", "ipa": "/ˈæk.tər/", "pos": "noun", "example_en": "Hollywood actor.", "example_ar": "ممثل هوليوود." },
    { "en": "Pilot", "ar": "طيار", "ipa": "/ˈpaɪ.lət/", "pos": "noun", "example_en": "Airline pilot.", "example_ar": "طيار طيران." },
    { "en": "Scientist", "ar": "عالم", "ipa": "/ˈsaɪ.ən.tɪst/", "pos": "noun", "example_en": "Brilliant scientist.", "example_ar": "عالم لامع." },
    { "en": "Dentist", "ar": "طبيب أسنان", "ipa": "/ˈden.tɪst/", "pos": "noun", "example_en": "Visit the dentist.", "example_ar": "زر طبيب الأسنان." },
    { "en": "Mechanic", "ar": "ميكانيكي", "ipa": "/məˈkæn.ɪk/", "pos": "noun", "example_en": "Car mechanic.", "example_ar": "ميكانيكي سيارات." },
    { "en": "Plumber", "ar": "سباك", "ipa": "/ˈplʌm.ər/", "pos": "noun", "example_en": "Call a plumber.", "example_ar": "اتصل بسباك." },
    { "en": "Electrician", "ar": "كهربائي", "ipa": "/ˌel.ekˈtrɪʃ.ən/", "pos": "noun", "example_en": "Skilled electrician.", "example_ar": "كهربائي ماهر." },
    { "en": "Architect", "ar": "مهندس معماري", "ipa": "/ˈɑːr.kɪ.tekt/", "pos": "noun", "example_en": "Famous architect.", "example_ar": "مهندس معماري مشهور." },
    { "en": "Accountant", "ar": "محاسب", "ipa": "/əˈkaʊn.tənt/", "pos": "noun", "example_en": "Hire an accountant.", "example_ar": "وظف محاسباً." },
    { "en": "Translator", "ar": "مترجم", "ipa": "/trænzˈleɪ.t̬ər/", "pos": "noun", "example_en": "Arabic translator.", "example_ar": "مترجم عربي." },
    { "en": "Journalist", "ar": "صحفي", "ipa": "/ˈdʒɝː.nə.lɪst/", "pos": "noun", "example_en": "TV journalist.", "example_ar": "صحفي تلفزيوني." },
    { "en": "Designer", "ar": "مصمم", "ipa": "/dɪˈzaɪ.nər/", "pos": "noun", "example_en": "Fashion designer.", "example_ar": "مصمم أزياء." }
  ]
}
