{
  "id": "vocab-08",
  "title": "الوقت والساعة",
  "title_en": "Time & Clock",
  "level": "A1",
  "theme": "time",
  "description_ar": "كلمات قراءة الوقت والأجزاء الزمنية.",
  "words": [
    { "en": "Time", "ar": "وقت", "ipa": "/taɪm/", "pos": "noun", "example_en": "What time is it?", "example_ar": "كم الساعة؟" },
    { "en": "Hour", "ar": "ساعة", "ipa": "/aʊr/", "pos": "noun", "example_en": "One hour later.", "example_ar": "بعد ساعة." },
    { "en": "Minute", "ar": "دقيقة", "ipa": "/ˈmɪn.ɪt/", "pos": "noun", "example_en": "Wait a minute.", "example_ar": "انتظر دقيقة." },
    { "en": "Second", "ar": "ثانية", "ipa": "/ˈsek.ənd/", "pos": "noun", "example_en": "Just one second.", "example_ar": "ثانية واحدة فقط." },
    { "en": "Clock", "ar": "ساعة حائط", "ipa": "/klɑːk/", "pos": "noun", "example_en": "The clock is broken.", "example_ar": "الساعة معطلة." },
    { "en": "Watch", "ar": "ساعة يد", "ipa": "/wɑːtʃ/", "pos": "noun", "example_en": "I lost my watch.", "example_ar": "فقدت ساعتي." },
    { "en": "Morning", "ar": "صباح", "ipa": "/ˈmɔːr.nɪŋ/", "pos": "noun", "example_en": "I work in the morning.", "example_ar": "أعمل في الصباح." },
    { "en": "Afternoon", "ar": "بعد الظهر", "ipa": "/ˌæf.tərˈnuːn/", "pos": "noun", "example_en": "See you this afternoon.", "example_ar": "أراك بعد الظهر." },
    { "en": "Evening", "ar": "مساء", "ipa": "/ˈiːv.nɪŋ/", "pos": "noun", "example_en": "Good evening!", "example_ar": "مساء الخير!" },
    { "en": "Night", "ar": "ليل", "ipa": "/naɪt/", "pos": "noun", "example_en": "Good night.", "example_ar": "تصبح على خير." },
    { "en": "Noon", "ar": "ظهر", "ipa": "/nuːn/", "pos": "noun", "example_en": "Lunch at noon.", "example_ar": "الغداء عند الظهر." },
    { "en": "Midnight", "ar": "منتصف الليل", "ipa": "/ˈmɪd.naɪt/", "pos": "noun", "example_en": "It's almost midnight.", "example_ar": "اقترب منتصف الليل." },
    { "en": "Now", "ar": "الآن", "ipa": "/naʊ/", "pos": "adverb", "example_en": "Come here now.", "example_ar": "تعال هنا الآن." },
    { "en": "Later", "ar": "لاحقاً", "ipa": "/ˈleɪ.t̬ər/", "pos": "adverb", "example_en": "I'll call later.", "example_ar": "سأتصل لاحقاً." },
    { "en": "Soon", "ar": "قريباً", "ipa": "/suːn/", "pos": "adverb", "example_en": "See you soon.", "example_ar": "أراك قريباً." },
    { "en": "Early", "ar": "مبكراً", "ipa": "/ˈɜːr.li/", "pos": "adverb", "example_en": "I wake up early.", "example_ar": "أستيقظ مبكراً." },
    { "en": "Late", "ar": "متأخراً", "ipa": "/leɪt/", "pos": "adverb", "example_en": "Sorry, I'm late.", "example_ar": "آسف، أنا متأخر." },
    { "en": "Yesterday", "ar": "أمس", "ipa": "/ˈjes.tər.deɪ/", "pos": "adverb", "example_en": "I saw him yesterday.", "example_ar": "رأيته أمس." },
    { "en": "Tomorrow", "ar": "غداً", "ipa": "/təˈmɑːr.oʊ/", "pos": "adverb", "example_en": "See you tomorrow.", "example_ar": "أراك غداً." },
    { "en": "Tonight", "ar": "الليلة", "ipa": "/təˈnaɪt/", "pos": "adverb", "example_en": "Let's eat out tonight.", "example_ar": "لنأكل بالخارج الليلة." },
    { "en": "Always", "ar": "دائماً", "ipa": "/ˈɔːl.weɪz/", "pos": "adverb", "example_en": "I always study.", "example_ar": "أدرس دائماً." },
    { "en": "Never", "ar": "أبداً", "ipa": "/ˈnev.ər/", "pos": "adverb", "example_en": "I never smoke.", "example_ar": "لا أدخن أبداً." },
    { "en": "Often", "ar": "غالباً", "ipa": "/ˈɒf.ən/", "pos": "adverb", "example_en": "We often meet.", "example_ar": "نلتقي غالباً." },
    { "en": "Sometimes", "ar": "أحياناً", "ipa": "/ˈsʌm.taɪmz/", "pos": "adverb", "example_en": "Sometimes I cook.", "example_ar": "أحياناً أطبخ." },
    { "en": "Daily", "ar": "يومياً", "ipa": "/ˈdeɪ.li/", "pos": "adverb", "example_en": "I exercise daily.", "example_ar": "أتمرن يومياً." }
  ]
}
