{
  "id": "vocab-40",
  "title": "كلمات وروابط شائعة",
  "title_en": "Common Connectors & Phrases",
  "level": "A2",
  "theme": "common",
  "description_ar": "كلمات شائعة جداً وروابط ومفردات عامة.",
  "words": [
    { "en": "And", "ar": "و", "ipa": "/ænd/", "pos": "conjunction", "example_en": "Me and you.", "example_ar": "أنا وأنت." },
    { "en": "Or", "ar": "أو", "ipa": "/ɔːr/", "pos": "conjunction", "example_en": "Tea or coffee?", "example_ar": "شاي أم قهوة؟" },
    { "en": "But", "ar": "لكن", "ipa": "/bʌt/", "pos": "conjunction", "example_en": "Small but strong.", "example_ar": "صغير لكنه قوي." },
    { "en": "Because", "ar": "لأن", "ipa": "/bɪˈkɔːz/", "pos": "conjunction", "example_en": "Because it's late.", "example_ar": "لأنه متأخر." },
    { "en": "So", "ar": "إذن / لذلك", "ipa": "/soʊ/", "pos": "conjunction", "example_en": "It's hot, so drink water.", "example_ar": "الجو حار، لذا اشرب ماء." },
    { "en": "If", "ar": "إذا", "ipa": "/ɪf/", "pos": "conjunction", "example_en": "If you can.", "example_ar": "إذا استطعت." },
    { "en": "When", "ar": "متى / عندما", "ipa": "/wen/", "pos": "adverb", "example_en": "When did you come?", "example_ar": "متى أتيت؟" },
    { "en": "Where", "ar": "أين", "ipa": "/wer/", "pos": "adverb", "example_en": "Where are you?", "example_ar": "أين أنت؟" },
    { "en": "Why", "ar": "لماذا", "ipa": "/waɪ/", "pos": "adverb", "example_en": "Why not?", "example_ar": "لمَ لا؟" },
    { "en": "How", "ar": "كيف", "ipa": "/haʊ/", "pos": "adverb", "example_en": "How are you?", "example_ar": "كيف حالك؟" },
    { "en": "What", "ar": "ماذا", "ipa": "/wʌt/", "pos": "pronoun", "example_en": "What is this?", "example_ar": "ما هذا؟" },
    { "en": "Who", "ar": "من", "ipa": "/huː/", "pos": "pronoun", "example_en": "Who is he?", "example_ar": "من هو؟" },
    { "en": "Which", "ar": "أيّ", "ipa": "/wɪtʃ/", "pos": "pronoun", "example_en": "Which one?", "example_ar": "أيّ واحد؟" },
    { "en": "This", "ar": "هذا", "ipa": "/ðɪs/", "pos": "pronoun", "example_en": "This is mine.", "example_ar": "هذا لي." },
    { "en": "That", "ar": "ذلك", "ipa": "/ðæt/", "pos": "pronoun", "example_en": "That is yours.", "example_ar": "ذلك لك." },
    { "en": "These", "ar": "هؤلاء", "ipa": "/ðiːz/", "pos": "pronoun", "example_en": "These are books.", "example_ar": "هذه كتب." },
    { "en": "Those", "ar": "أولئك", "ipa": "/ðoʊz/", "pos": "pronoun", "example_en": "Those are mine.", "example_ar": "تلك لي." },
    { "en": "Very", "ar": "جداً", "ipa": "/ˈver.i/", "pos": "adverb", "example_en": "Very good.", "example_ar": "جيد جداً." },
    { "en": "Really", "ar": "فعلاً", "ipa": "/ˈriː.li/", "pos": "adverb", "example_en": "Really hot.", "example_ar": "حار فعلاً." },
    { "en": "Maybe", "ar": "ربما", "ipa": "/ˈmeɪ.bi/", "pos": "adverb", "example_en": "Maybe tomorrow.", "example_ar": "ربما غداً." },
    { "en": "Sure", "ar": "بالتأكيد", "ipa": "/ʃʊr/", "pos": "adverb", "example_en": "Sure, I can.", "example_ar": "بالتأكيد، أستطيع." },
    { "en": "Of course", "ar": "بالطبع", "ipa": "/əv kɔːrs/", "pos": "phrase", "example_en": "Of course!", "example_ar": "بالطبع!" },
    { "en": "Okay", "ar": "حسناً", "ipa": "/ˌoʊˈkeɪ/", "pos": "adverb", "example_en": "Okay, let's go.", "example_ar": "حسناً، لنذهب." },
    { "en": "Right", "ar": "صحيح / يمين", "ipa": "/raɪt/", "pos": "adjective", "example_en": "That's right.", "example_ar": "هذا صحيح." },
    { "en": "Wrong", "ar": "خطأ", "ipa": "/rɔːŋ/", "pos": "adjective", "example_en": "Wrong answer.", "example_ar": "إجابة خاطئة." }
  ]
}
