{
  "id": "vocab-02",
  "title": "الأرقام من 1 إلى 20",
  "title_en": "Numbers 1-20",
  "level": "A1",
  "theme": "numbers",
  "description_ar": "تعلم أهم 25 رقماً وكلمات العدّ الأساسية.",
  "words": [
    { "en": "Zero", "ar": "صفر", "ipa": "/ˈzɪr.oʊ/", "pos": "number", "example_en": "My phone has zero battery.", "example_ar": "هاتفي بطاريته صفر." },
    { "en": "One", "ar": "واحد", "ipa": "/wʌn/", "pos": "number", "example_en": "I have one brother.", "example_ar": "لدي أخ واحد." },
    { "en": "Two", "ar": "اثنان", "ipa": "/tuː/", "pos": "number", "example_en": "Two coffees, please.", "example_ar": "قهوتان من فضلك." },
    { "en": "Three", "ar": "ثلاثة", "ipa": "/θriː/", "pos": "number", "example_en": "I have three cats.", "example_ar": "لدي ثلاث قطط." },
    { "en": "Four", "ar": "أربعة", "ipa": "/fɔːr/", "pos": "number", "example_en": "Four seasons in a year.", "example_ar": "أربعة فصول في السنة." },
    { "en": "Five", "ar": "خمسة", "ipa": "/faɪv/", "pos": "number", "example_en": "I have five fingers.", "example_ar": "لدي خمسة أصابع." },
    { "en": "Six", "ar": "ستة", "ipa": "/sɪks/", "pos": "number", "example_en": "The class starts at six.", "example_ar": "الحصة تبدأ في السادسة." },
    { "en": "Seven", "ar": "سبعة", "ipa": "/ˈsev.ən/", "pos": "number", "example_en": "Seven days in a week.", "example_ar": "سبعة أيام في الأسبوع." },
    { "en": "Eight", "ar": "ثمانية", "ipa": "/eɪt/", "pos": "number", "example_en": "I wake up at eight.", "example_ar": "أستيقظ في الثامنة." },
    { "en": "Nine", "ar": "تسعة", "ipa": "/naɪn/", "pos": "number", "example_en": "Nine students are absent.", "example_ar": "تسعة طلاب غائبون." },
    { "en": "Ten", "ar": "عشرة", "ipa": "/ten/", "pos": "number", "example_en": "Ten dollars, please.", "example_ar": "عشرة دولارات من فضلك." },
    { "en": "Eleven", "ar": "أحد عشر", "ipa": "/ɪˈlev.ən/", "pos": "number", "example_en": "I sleep at eleven.", "example_ar": "أنام في الحادية عشرة." },
    { "en": "Twelve", "ar": "اثنا عشر", "ipa": "/twelv/", "pos": "number", "example_en": "Twelve months in a year.", "example_ar": "اثنا عشر شهراً في السنة." },
    { "en": "Thirteen", "ar": "ثلاثة عشر", "ipa": "/ˌθɜːrˈtiːn/", "pos": "number", "example_en": "He is thirteen years old.", "example_ar": "عمره ثلاثة عشر عاماً." },
    { "en": "Fourteen", "ar": "أربعة عشر", "ipa": "/ˌfɔːrˈtiːn/", "pos": "number", "example_en": "She bought fourteen apples.", "example_ar": "اشترت أربع عشرة تفاحة." },
    { "en": "Fifteen", "ar": "خمسة عشر", "ipa": "/ˌfɪfˈtiːn/", "pos": "number", "example_en": "Wait fifteen minutes.", "example_ar": "انتظر خمس عشرة دقيقة." },
    { "en": "Sixteen", "ar": "ستة عشر", "ipa": "/ˌsɪksˈtiːn/", "pos": "number", "example_en": "I am sixteen.", "example_ar": "عمري ستة عشر." },
    { "en": "Seventeen", "ar": "سبعة عشر", "ipa": "/ˌsev.ənˈtiːn/", "pos": "number", "example_en": "Seventeen people came.", "example_ar": "حضر سبعة عشر شخصاً." },
    { "en": "Eighteen", "ar": "ثمانية عشر", "ipa": "/ˌeɪˈtiːn/", "pos": "number", "example_en": "He is eighteen.", "example_ar": "عمره ثمانية عشر." },
    { "en": "Nineteen", "ar": "تسعة عشر", "ipa": "/ˌnaɪnˈtiːn/", "pos": "number", "example_en": "Nineteen students passed.", "example_ar": "نجح تسعة عشر طالباً." },
    { "en": "Twenty", "ar": "عشرون", "ipa": "/ˈtwen.ti/", "pos": "number", "example_en": "Twenty dollars, please.", "example_ar": "عشرون دولاراً من فضلك." },
    { "en": "First", "ar": "الأول", "ipa": "/fɜːrst/", "pos": "adjective", "example_en": "He came first.", "example_ar": "جاء أولاً." },
    { "en": "Second", "ar": "الثاني", "ipa": "/ˈsek.ənd/", "pos": "adjective", "example_en": "The second floor.", "example_ar": "الطابق الثاني." },
    { "en": "Third", "ar": "الثالث", "ipa": "/θɜːrd/", "pos": "adjective", "example_en": "Third time lucky.", "example_ar": "المرة الثالثة محظوظة." },
    { "en": "Number", "ar": "رقم", "ipa": "/ˈnʌm.bər/", "pos": "noun", "example_en": "What is your number?", "example_ar": "ما رقمك؟" }
  ]
}
