{
  "id": "vocab-22",
  "title": "المكتب والعمل",
  "title_en": "Office & Workplace",
  "level": "A2",
  "theme": "work",
  "description_ar": "كلمات بيئة العمل والمكتب.",
  "words": [
    { "en": "Office", "ar": "مكتب", "ipa": "/ˈɑː.fɪs/", "pos": "noun", "example_en": "Modern office.", "example_ar": "مكتب حديث." },
    { "en": "Work", "ar": "عمل", "ipa": "/wɜːrk/", "pos": "noun", "example_en": "Hard work.", "example_ar": "عمل شاق." },
    { "en": "Job", "ar": "وظيفة", "ipa": "/dʒɑːb/", "pos": "noun", "example_en": "A new job.", "example_ar": "وظيفة جديدة." },
    { "en": "Computer", "ar": "حاسوب", "ipa": "/kəmˈpjuː.t̬ər/", "pos": "noun", "example_en": "Use the computer.", "example_ar": "استخدم الحاسوب." },
    { "en": "Laptop", "ar": "حاسوب محمول", "ipa": "/ˈlæp.tɑːp/", "pos": "noun", "example_en": "My new laptop.", "example_ar": "حاسوبي المحمول الجديد." },
    { "en": "Email", "ar": "بريد إلكتروني", "ipa": "/ˈiː.meɪl/", "pos": "noun", "example_en": "Send an email.", "example_ar": "أرسل بريداً إلكترونياً." },
    { "en": "Phone call", "ar": "مكالمة هاتفية", "ipa": "/foʊn kɔːl/", "pos": "noun", "example_en": "An important phone call.", "example_ar": "مكالمة مهمة." },
    { "en": "Meeting", "ar": "اجتماع", "ipa": "/ˈmiː.t̬ɪŋ/", "pos": "noun", "example_en": "Team meeting.", "example_ar": "اجتماع الفريق." },
    { "en": "Boss", "ar": "مدير", "ipa": "/bɔːs/", "pos": "noun", "example_en": "My boss is kind.", "example_ar": "مديري طيب." },
    { "en": "Manager", "ar": "مدير", "ipa": "/ˈmæn.ɪ.dʒər/", "pos": "noun", "example_en": "Project manager.", "example_ar": "مدير المشروع." },
    { "en": "Colleague", "ar": "زميل", "ipa": "/ˈkɑː.liːɡ/", "pos": "noun", "example_en": "My colleague.", "example_ar": "زميلي في العمل." },
    { "en": "Team", "ar": "فريق", "ipa": "/tiːm/", "pos": "noun", "example_en": "A good team.", "example_ar": "فريق جيد." },
    { "en": "Project", "ar": "مشروع", "ipa": "/ˈprɑː.dʒekt/", "pos": "noun", "example_en": "A new project.", "example_ar": "مشروع جديد." },
    { "en": "Deadline", "ar": "موعد نهائي", "ipa": "/ˈded.laɪn/", "pos": "noun", "example_en": "Tight deadline.", "example_ar": "موعد نهائي ضيق." },
    { "en": "Salary", "ar": "راتب", "ipa": "/ˈsæl.ər.i/", "pos": "noun", "example_en": "Monthly salary.", "example_ar": "راتب شهري." },
    { "en": "Company", "ar": "شركة", "ipa": "/ˈkʌm.pə.ni/", "pos": "noun", "example_en": "A big company.", "example_ar": "شركة كبيرة." },
    { "en": "Customer", "ar": "زبون", "ipa": "/ˈkʌs.tə.mər/", "pos": "noun", "example_en": "A happy customer.", "example_ar": "زبون سعيد." },
    { "en": "Client", "ar": "عميل", "ipa": "/ˈklaɪ.ənt/", "pos": "noun", "example_en": "Important client.", "example_ar": "عميل مهم." },
    { "en": "Document", "ar": "وثيقة", "ipa": "/ˈdɑː.kjə.mənt/", "pos": "noun", "example_en": "Sign the document.", "example_ar": "وقع على الوثيقة." },
    { "en": "Printer", "ar": "طابعة", "ipa": "/ˈprɪn.t̬ər/", "pos": "noun", "example_en": "The printer works.", "example_ar": "الطابعة تعمل." },
    { "en": "File", "ar": "ملف", "ipa": "/faɪl/", "pos": "noun", "example_en": "Open the file.", "example_ar": "افتح الملف." },
    { "en": "Schedule", "ar": "جدول", "ipa": "/ˈskedʒ.uːl/", "pos": "noun", "example_en": "Busy schedule.", "example_ar": "جدول مزدحم." },
    { "en": "Break", "ar": "استراحة", "ipa": "/breɪk/", "pos": "noun", "example_en": "Take a break.", "example_ar": "خذ استراحة." },
    { "en": "Office hours", "ar": "ساعات العمل", "ipa": "/ˈɑː.fɪs aʊrz/", "pos": "noun", "example_en": "Standard office hours.", "example_ar": "ساعات عمل عادية." },
    { "en": "Vacation", "ar": "إجازة", "ipa": "/veɪˈkeɪ.ʃən/", "pos": "noun", "example_en": "Summer vacation.", "example_ar": "إجازة الصيف." }
  ]
}
