{
  "id": "vocab-14",
  "title": "الطعام - أساسيات",
  "title_en": "Food Basics",
  "level": "A1",
  "theme": "food",
  "description_ar": "أهم الأطعمة والمكونات الأساسية.",
  "words": [
    { "en": "Food", "ar": "طعام", "ipa": "/fuːd/", "pos": "noun", "example_en": "Healthy food.", "example_ar": "طعام صحي." },
    { "en": "Bread", "ar": "خبز", "ipa": "/bred/", "pos": "noun", "example_en": "Fresh bread.", "example_ar": "خبز طازج." },
    { "en": "Rice", "ar": "أرز", "ipa": "/raɪs/", "pos": "noun", "example_en": "White rice.", "example_ar": "أرز أبيض." },
    { "en": "Pasta", "ar": "معكرونة", "ipa": "/ˈpɑː.stə/", "pos": "noun", "example_en": "Italian pasta.", "example_ar": "معكرونة إيطالية." },
    { "en": "Meat", "ar": "لحم", "ipa": "/miːt/", "pos": "noun", "example_en": "Red meat.", "example_ar": "لحم أحمر." },
    { "en": "Chicken", "ar": "دجاج", "ipa": "/ˈtʃɪk.ɪn/", "pos": "noun", "example_en": "Grilled chicken.", "example_ar": "دجاج مشوي." },
    { "en": "Beef", "ar": "لحم بقر", "ipa": "/biːf/", "pos": "noun", "example_en": "Beef burger.", "example_ar": "برغر لحم بقر." },
    { "en": "Fish", "ar": "سمك", "ipa": "/fɪʃ/", "pos": "noun", "example_en": "Fresh fish.", "example_ar": "سمك طازج." },
    { "en": "Egg", "ar": "بيضة", "ipa": "/eɡ/", "pos": "noun", "example_en": "A boiled egg.", "example_ar": "بيضة مسلوقة." },
    { "en": "Cheese", "ar": "جبن", "ipa": "/tʃiːz/", "pos": "noun", "example_en": "Yellow cheese.", "example_ar": "جبن أصفر." },
    { "en": "Butter", "ar": "زبدة", "ipa": "/ˈbʌt̬.ər/", "pos": "noun", "example_en": "Butter on toast.", "example_ar": "زبدة على التوست." },
    { "en": "Milk", "ar": "حليب", "ipa": "/mɪlk/", "pos": "noun", "example_en": "A glass of milk.", "example_ar": "كوب حليب." },
    { "en": "Yogurt", "ar": "زبادي", "ipa": "/ˈjoʊ.ɡərt/", "pos": "noun", "example_en": "Fresh yogurt.", "example_ar": "زبادي طازج." },
    { "en": "Sugar", "ar": "سكر", "ipa": "/ˈʃʊɡ.ər/", "pos": "noun", "example_en": "Too much sugar.", "example_ar": "سكر زيادة." },
    { "en": "Salt", "ar": "ملح", "ipa": "/sɔːlt/", "pos": "noun", "example_en": "Add some salt.", "example_ar": "أضف قليلاً من الملح." },
    { "en": "Pepper", "ar": "فلفل", "ipa": "/ˈpep.ər/", "pos": "noun", "example_en": "Black pepper.", "example_ar": "فلفل أسود." },
    { "en": "Oil", "ar": "زيت", "ipa": "/ɔɪl/", "pos": "noun", "example_en": "Olive oil.", "example_ar": "زيت زيتون." },
    { "en": "Flour", "ar": "طحين", "ipa": "/ˈflaʊr/", "pos": "noun", "example_en": "Wheat flour.", "example_ar": "طحين قمح." },
    { "en": "Soup", "ar": "حساء", "ipa": "/suːp/", "pos": "noun", "example_en": "Chicken soup.", "example_ar": "حساء دجاج." },
    { "en": "Salad", "ar": "سلطة", "ipa": "/ˈsæl.əd/", "pos": "noun", "example_en": "Green salad.", "example_ar": "سلطة خضراء." },
    { "en": "Sandwich", "ar": "ساندويتش", "ipa": "/ˈsænd.wɪtʃ/", "pos": "noun", "example_en": "A cheese sandwich.", "example_ar": "ساندويتش جبن." },
    { "en": "Pizza", "ar": "بيتزا", "ipa": "/ˈpiːt.sə/", "pos": "noun", "example_en": "Hot pizza.", "example_ar": "بيتزا ساخنة." },
    { "en": "Cake", "ar": "كعكة", "ipa": "/keɪk/", "pos": "noun", "example_en": "Chocolate cake.", "example_ar": "كعكة شوكولاتة." },
    { "en": "Honey", "ar": "عسل", "ipa": "/ˈhʌn.i/", "pos": "noun", "example_en": "Sweet honey.", "example_ar": "عسل حلو." },
    { "en": "Jam", "ar": "مربى", "ipa": "/dʒæm/", "pos": "noun", "example_en": "Strawberry jam.", "example_ar": "مربى فراولة." }
  ]
}
