{
  "id": "vocab-01",
  "title": "التحيات والمقدمات",
  "title_en": "Greetings & Introductions",
  "level": "A1",
  "theme": "greetings",
  "description_ar": "أهم 25 كلمة وعبارة للتحية والتعريف بالنفس باللغة الإنجليزية.",
  "words": [
    { "en": "Hello", "ar": "مرحباً", "ipa": "/həˈloʊ/", "pos": "interjection", "example_en": "Hello, how are you?", "example_ar": "مرحباً، كيف حالك؟" },
    { "en": "Hi", "ar": "أهلاً", "ipa": "/haɪ/", "pos": "interjection", "example_en": "Hi! Nice to see you.", "example_ar": "أهلاً! سعيد برؤيتك." },
    { "en": "Good morning", "ar": "صباح الخير", "ipa": "/ɡʊd ˈmɔːr.nɪŋ/", "pos": "phrase", "example_en": "Good morning, everyone.", "example_ar": "صباح الخير للجميع." },
    { "en": "Good afternoon", "ar": "مساء الخير (بعد الظهر)", "ipa": "/ɡʊd ˌæf.tərˈnuːn/", "pos": "phrase", "example_en": "Good afternoon, sir.", "example_ar": "مساء الخير يا سيدي." },
    { "en": "Good evening", "ar": "مساء الخير", "ipa": "/ɡʊd ˈiːv.nɪŋ/", "pos": "phrase", "example_en": "Good evening, ladies and gentlemen.", "example_ar": "مساء الخير سيداتي وسادتي." },
    { "en": "Goodbye", "ar": "وداعاً", "ipa": "/ɡʊdˈbaɪ/", "pos": "interjection", "example_en": "Goodbye, see you tomorrow.", "example_ar": "وداعاً، أراك غداً." },
    { "en": "Bye", "ar": "إلى اللقاء", "ipa": "/baɪ/", "pos": "interjection", "example_en": "Bye! Have a nice day.", "example_ar": "إلى اللقاء! أتمنى لك يوماً سعيداً." },
    { "en": "See you", "ar": "إلى اللقاء", "ipa": "/siː juː/", "pos": "phrase", "example_en": "See you later!", "example_ar": "أراك لاحقاً!" },
    { "en": "Please", "ar": "من فضلك", "ipa": "/pliːz/", "pos": "adverb", "example_en": "Please sit down.", "example_ar": "من فضلك اجلس." },
    { "en": "Thank you", "ar": "شكراً لك", "ipa": "/θæŋk juː/", "pos": "phrase", "example_en": "Thank you for your help.", "example_ar": "شكراً لك على مساعدتك." },
    { "en": "You're welcome", "ar": "العفو", "ipa": "/jʊr ˈwel.kəm/", "pos": "phrase", "example_en": "You're welcome, anytime.", "example_ar": "العفو، في أي وقت." },
    { "en": "Sorry", "ar": "آسف", "ipa": "/ˈsɒr.i/", "pos": "adjective", "example_en": "I'm sorry I'm late.", "example_ar": "آسف على التأخير." },
    { "en": "Excuse me", "ar": "اعذرني / المعذرة", "ipa": "/ɪkˈskjuːz miː/", "pos": "phrase", "example_en": "Excuse me, where is the bank?", "example_ar": "المعذرة، أين البنك؟" },
    { "en": "Yes", "ar": "نعم", "ipa": "/jes/", "pos": "adverb", "example_en": "Yes, I agree.", "example_ar": "نعم، أوافق." },
    { "en": "No", "ar": "لا", "ipa": "/noʊ/", "pos": "adverb", "example_en": "No, thank you.", "example_ar": "لا، شكراً." },
    { "en": "How are you", "ar": "كيف حالك؟", "ipa": "/haʊ ɑːr juː/", "pos": "phrase", "example_en": "Hi! How are you today?", "example_ar": "أهلاً! كيف حالك اليوم؟" },
    { "en": "I'm fine", "ar": "أنا بخير", "ipa": "/aɪm faɪn/", "pos": "phrase", "example_en": "I'm fine, thank you.", "example_ar": "أنا بخير، شكراً." },
    { "en": "Name", "ar": "اسم", "ipa": "/neɪm/", "pos": "noun", "example_en": "What is your name?", "example_ar": "ما اسمك؟" },
    { "en": "My name is", "ar": "اسمي هو", "ipa": "/maɪ neɪm ɪz/", "pos": "phrase", "example_en": "My name is Ahmed.", "example_ar": "اسمي أحمد." },
    { "en": "Nice to meet you", "ar": "سررت بلقائك", "ipa": "/naɪs tuː miːt juː/", "pos": "phrase", "example_en": "Nice to meet you, Sarah.", "example_ar": "سررت بلقائك يا سارة." },
    { "en": "Welcome", "ar": "أهلاً وسهلاً", "ipa": "/ˈwel.kəm/", "pos": "interjection", "example_en": "Welcome to our home.", "example_ar": "أهلاً وسهلاً في بيتنا." },
    { "en": "Friend", "ar": "صديق", "ipa": "/frend/", "pos": "noun", "example_en": "He is my best friend.", "example_ar": "إنه أفضل صديق لي." },
    { "en": "Mister", "ar": "السيد", "ipa": "/ˈmɪs.tər/", "pos": "noun", "example_en": "Good morning, Mister Smith.", "example_ar": "صباح الخير سيد سميث." },
    { "en": "Madam", "ar": "السيدة", "ipa": "/ˈmæd.əm/", "pos": "noun", "example_en": "May I help you, madam?", "example_ar": "هل يمكنني مساعدتك يا سيدتي؟" },
    { "en": "How do you do", "ar": "تشرفت بمعرفتك", "ipa": "/haʊ duː juː duː/", "pos": "phrase", "example_en": "How do you do? I'm Mr. Lee.", "example_ar": "تشرفت بمعرفتك، أنا السيد لي." }
  ]
}
