{
  "id": "vocab-31",
  "title": "الطبيعة",
  "title_en": "Nature",
  "level": "A1",
  "theme": "nature",
  "description_ar": "كلمات الطبيعة والبيئة.",
  "words": [
    { "en": "Nature", "ar": "طبيعة", "ipa": "/ˈneɪ.tʃər/", "pos": "noun", "example_en": "I love nature.", "example_ar": "أحب الطبيعة." },
    { "en": "Tree", "ar": "شجرة", "ipa": "/triː/", "pos": "noun", "example_en": "A tall tree.", "example_ar": "شجرة طويلة." },
    { "en": "Flower", "ar": "زهرة", "ipa": "/ˈflaʊ.ər/", "pos": "noun", "example_en": "Red flowers.", "example_ar": "زهور حمراء." },
    { "en": "Plant", "ar": "نبتة", "ipa": "/plænt/", "pos": "noun", "example_en": "Green plants.", "example_ar": "نباتات خضراء." },
    { "en": "Grass", "ar": "عشب", "ipa": "/ɡræs/", "pos": "noun", "example_en": "Green grass.", "example_ar": "عشب أخضر." },
    { "en": "Leaf", "ar": "ورقة شجر", "ipa": "/liːf/", "pos": "noun", "example_en": "A green leaf.", "example_ar": "ورقة شجر خضراء." },
    { "en": "Sky", "ar": "سماء", "ipa": "/skaɪ/", "pos": "noun", "example_en": "Blue sky.", "example_ar": "سماء زرقاء." },
    { "en": "Moon", "ar": "قمر", "ipa": "/muːn/", "pos": "noun", "example_en": "Full moon.", "example_ar": "بدر." },
    { "en": "Star", "ar": "نجم", "ipa": "/stɑːr/", "pos": "noun", "example_en": "Many stars.", "example_ar": "نجوم كثيرة." },
    { "en": "Sea", "ar": "بحر", "ipa": "/siː/", "pos": "noun", "example_en": "Calm sea.", "example_ar": "بحر هادئ." },
    { "en": "Ocean", "ar": "محيط", "ipa": "/ˈoʊ.ʃən/", "pos": "noun", "example_en": "Deep ocean.", "example_ar": "محيط عميق." },
    { "en": "River", "ar": "نهر", "ipa": "/ˈrɪv.ər/", "pos": "noun", "example_en": "A long river.", "example_ar": "نهر طويل." },
    { "en": "Lake", "ar": "بحيرة", "ipa": "/leɪk/", "pos": "noun", "example_en": "A blue lake.", "example_ar": "بحيرة زرقاء." },
    { "en": "Beach", "ar": "شاطئ", "ipa": "/biːtʃ/", "pos": "noun", "example_en": "Sandy beach.", "example_ar": "شاطئ رملي." },
    { "en": "Mountain", "ar": "جبل", "ipa": "/ˈmaʊn.t̬ən/", "pos": "noun", "example_en": "High mountain.", "example_ar": "جبل عالٍ." },
    { "en": "Hill", "ar": "تل", "ipa": "/hɪl/", "pos": "noun", "example_en": "A small hill.", "example_ar": "تل صغير." },
    { "en": "Forest", "ar": "غابة", "ipa": "/ˈfɔːr.ɪst/", "pos": "noun", "example_en": "Dense forest.", "example_ar": "غابة كثيفة." },
    { "en": "Desert", "ar": "صحراء", "ipa": "/ˈdez.ərt/", "pos": "noun", "example_en": "Hot desert.", "example_ar": "صحراء حارة." },
    { "en": "Island", "ar": "جزيرة", "ipa": "/ˈaɪ.lənd/", "pos": "noun", "example_en": "A small island.", "example_ar": "جزيرة صغيرة." },
    { "en": "Sand", "ar": "رمل", "ipa": "/sænd/", "pos": "noun", "example_en": "Soft sand.", "example_ar": "رمل ناعم." },
    { "en": "Stone", "ar": "حجر", "ipa": "/stoʊn/", "pos": "noun", "example_en": "A big stone.", "example_ar": "حجر كبير." },
    { "en": "Fire", "ar": "نار", "ipa": "/faɪr/", "pos": "noun", "example_en": "Hot fire.", "example_ar": "نار ساخنة." },
    { "en": "Earth", "ar": "أرض", "ipa": "/ɝːθ/", "pos": "noun", "example_en": "Save the earth.", "example_ar": "احمِ الأرض." },
    { "en": "Air", "ar": "هواء", "ipa": "/er/", "pos": "noun", "example_en": "Fresh air.", "example_ar": "هواء نقي." },
    { "en": "Rainbow", "ar": "قوس قزح", "ipa": "/ˈreɪn.boʊ/", "pos": "noun", "example_en": "A beautiful rainbow.", "example_ar": "قوس قزح جميل." }
  ]
}
