{
  "id": "vocab-29",
  "title": "الحيوانات البرية والبحرية",
  "title_en": "Wild & Sea Animals",
  "level": "A2",
  "theme": "animals",
  "description_ar": "حيوانات الغابة والبحر والحشرات.",
  "words": [
    { "en": "Lion", "ar": "أسد", "ipa": "/ˈlaɪ.ən/", "pos": "noun", "example_en": "The king lion.", "example_ar": "الأسد ملك الغابة." },
    { "en": "Tiger", "ar": "نمر", "ipa": "/ˈtaɪ.ɡər/", "pos": "noun", "example_en": "A striped tiger.", "example_ar": "نمر مخطط." },
    { "en": "Elephant", "ar": "فيل", "ipa": "/ˈel.ə.fənt/", "pos": "noun", "example_en": "A big elephant.", "example_ar": "فيل كبير." },
    { "en": "Giraffe", "ar": "زرافة", "ipa": "/dʒɪˈræf/", "pos": "noun", "example_en": "A tall giraffe.", "example_ar": "زرافة طويلة." },
    { "en": "Zebra", "ar": "حمار وحشي", "ipa": "/ˈziː.brə/", "pos": "noun", "example_en": "A striped zebra.", "example_ar": "حمار وحشي مخطط." },
    { "en": "Monkey", "ar": "قرد", "ipa": "/ˈmʌŋ.ki/", "pos": "noun", "example_en": "A playful monkey.", "example_ar": "قرد مرح." },
    { "en": "Bear", "ar": "دب", "ipa": "/ber/", "pos": "noun", "example_en": "A brown bear.", "example_ar": "دب بني." },
    { "en": "Wolf", "ar": "ذئب", "ipa": "/wʊlf/", "pos": "noun", "example_en": "A gray wolf.", "example_ar": "ذئب رمادي." },
    { "en": "Fox", "ar": "ثعلب", "ipa": "/fɑːks/", "pos": "noun", "example_en": "A clever fox.", "example_ar": "ثعلب ذكي." },
    { "en": "Deer", "ar": "غزال", "ipa": "/dɪr/", "pos": "noun", "example_en": "A wild deer.", "example_ar": "غزال بري." },
    { "en": "Snake", "ar": "ثعبان", "ipa": "/sneɪk/", "pos": "noun", "example_en": "A dangerous snake.", "example_ar": "ثعبان خطير." },
    { "en": "Lizard", "ar": "سحلية", "ipa": "/ˈlɪz.ərd/", "pos": "noun", "example_en": "A small lizard.", "example_ar": "سحلية صغيرة." },
    { "en": "Crocodile", "ar": "تمساح", "ipa": "/ˈkrɑː.kə.daɪl/", "pos": "noun", "example_en": "A river crocodile.", "example_ar": "تمساح نهر." },
    { "en": "Turtle", "ar": "سلحفاة", "ipa": "/ˈtɝː.t̬əl/", "pos": "noun", "example_en": "A slow turtle.", "example_ar": "سلحفاة بطيئة." },
    { "en": "Shark", "ar": "قرش", "ipa": "/ʃɑːrk/", "pos": "noun", "example_en": "A great white shark.", "example_ar": "قرش أبيض كبير." },
    { "en": "Dolphin", "ar": "دلفين", "ipa": "/ˈdɑːl.fɪn/", "pos": "noun", "example_en": "A friendly dolphin.", "example_ar": "دلفين ودود." },
    { "en": "Whale", "ar": "حوت", "ipa": "/weɪl/", "pos": "noun", "example_en": "A huge whale.", "example_ar": "حوت ضخم." },
    { "en": "Octopus", "ar": "أخطبوط", "ipa": "/ˈɑːk.tə.pəs/", "pos": "noun", "example_en": "A clever octopus.", "example_ar": "أخطبوط ذكي." },
    { "en": "Eagle", "ar": "نسر", "ipa": "/ˈiː.ɡəl/", "pos": "noun", "example_en": "A flying eagle.", "example_ar": "نسر يطير." },
    { "en": "Owl", "ar": "بومة", "ipa": "/aʊl/", "pos": "noun", "example_en": "A wise owl.", "example_ar": "بومة حكيمة." },
    { "en": "Butterfly", "ar": "فراشة", "ipa": "/ˈbʌt̬.ər.flaɪ/", "pos": "noun", "example_en": "A pretty butterfly.", "example_ar": "فراشة جميلة." },
    { "en": "Bee", "ar": "نحلة", "ipa": "/biː/", "pos": "noun", "example_en": "A busy bee.", "example_ar": "نحلة مشغولة." },
    { "en": "Ant", "ar": "نملة", "ipa": "/ænt/", "pos": "noun", "example_en": "Small ants.", "example_ar": "نمل صغير." },
    { "en": "Spider", "ar": "عنكبوت", "ipa": "/ˈspaɪ.dər/", "pos": "noun", "example_en": "A black spider.", "example_ar": "عنكبوت أسود." },
    { "en": "Mosquito", "ar": "بعوضة", "ipa": "/məˈskiː.t̬oʊ/", "pos": "noun", "example_en": "Annoying mosquito.", "example_ar": "بعوضة مزعجة." }
  ]
}
