{
  "id": "vocab-39",
  "title": "أحرف الجر والظروف",
  "title_en": "Prepositions & Adverbs",
  "level": "A1",
  "theme": "grammar-words",
  "description_ar": "أهم أحرف الجر وظروف المكان والزمان.",
  "words": [
    { "en": "In", "ar": "في", "ipa": "/ɪn/", "pos": "preposition", "example_en": "In the box.", "example_ar": "في الصندوق." },
    { "en": "On", "ar": "على", "ipa": "/ɑːn/", "pos": "preposition", "example_en": "On the table.", "example_ar": "على الطاولة." },
    { "en": "At", "ar": "عند", "ipa": "/æt/", "pos": "preposition", "example_en": "At home.", "example_ar": "في البيت." },
    { "en": "Under", "ar": "تحت", "ipa": "/ˈʌn.dər/", "pos": "preposition", "example_en": "Under the bed.", "example_ar": "تحت السرير." },
    { "en": "Over", "ar": "فوق", "ipa": "/ˈoʊ.vər/", "pos": "preposition", "example_en": "Over the bridge.", "example_ar": "فوق الجسر." },
    { "en": "Behind", "ar": "خلف", "ipa": "/bɪˈhaɪnd/", "pos": "preposition", "example_en": "Behind the door.", "example_ar": "خلف الباب." },
    { "en": "In front of", "ar": "أمام", "ipa": "/ɪn frʌnt əv/", "pos": "phrase", "example_en": "In front of the house.", "example_ar": "أمام البيت." },
    { "en": "Next to", "ar": "بجانب", "ipa": "/nekst tuː/", "pos": "phrase", "example_en": "Next to me.", "example_ar": "بجانبي." },
    { "en": "Between", "ar": "بين", "ipa": "/bɪˈtwiːn/", "pos": "preposition", "example_en": "Between us.", "example_ar": "بيننا." },
    { "en": "Near", "ar": "قريب من", "ipa": "/nɪr/", "pos": "preposition", "example_en": "Near the park.", "example_ar": "بالقرب من الحديقة." },
    { "en": "Far", "ar": "بعيد", "ipa": "/fɑːr/", "pos": "adverb", "example_en": "Far away.", "example_ar": "بعيداً." },
    { "en": "Here", "ar": "هنا", "ipa": "/hɪr/", "pos": "adverb", "example_en": "Come here.", "example_ar": "تعال هنا." },
    { "en": "There", "ar": "هناك", "ipa": "/ðer/", "pos": "adverb", "example_en": "Look there.", "example_ar": "انظر هناك." },
    { "en": "Up", "ar": "أعلى", "ipa": "/ʌp/", "pos": "adverb", "example_en": "Go up.", "example_ar": "اذهب لأعلى." },
    { "en": "Down", "ar": "أسفل", "ipa": "/daʊn/", "pos": "adverb", "example_en": "Look down.", "example_ar": "انظر للأسفل." },
    { "en": "Inside", "ar": "بالداخل", "ipa": "/ɪnˈsaɪd/", "pos": "preposition", "example_en": "Stay inside.", "example_ar": "ابقَ بالداخل." },
    { "en": "Outside", "ar": "بالخارج", "ipa": "/ˌaʊtˈsaɪd/", "pos": "preposition", "example_en": "Go outside.", "example_ar": "اذهب للخارج." },
    { "en": "Before", "ar": "قبل", "ipa": "/bɪˈfɔːr/", "pos": "preposition", "example_en": "Before lunch.", "example_ar": "قبل الغداء." },
    { "en": "After", "ar": "بعد", "ipa": "/ˈæf.tər/", "pos": "preposition", "example_en": "After dinner.", "example_ar": "بعد العشاء." },
    { "en": "With", "ar": "مع", "ipa": "/wɪð/", "pos": "preposition", "example_en": "With me.", "example_ar": "معي." },
    { "en": "Without", "ar": "بدون", "ipa": "/wɪˈðaʊt/", "pos": "preposition", "example_en": "Without sugar.", "example_ar": "بدون سكر." },
    { "en": "From", "ar": "من", "ipa": "/frʌm/", "pos": "preposition", "example_en": "From here.", "example_ar": "من هنا." },
    { "en": "To", "ar": "إلى", "ipa": "/tuː/", "pos": "preposition", "example_en": "Go to school.", "example_ar": "اذهب إلى المدرسة." },
    { "en": "About", "ar": "عن", "ipa": "/əˈbaʊt/", "pos": "preposition", "example_en": "Talk about it.", "example_ar": "تحدث عنه." },
    { "en": "Through", "ar": "عبر", "ipa": "/θruː/", "pos": "preposition", "example_en": "Through the door.", "example_ar": "عبر الباب." }
  ]
}
