{
  "id": "vocab-24",
  "title": "الأفعال اليومية",
  "title_en": "Daily Verbs",
  "level": "A1",
  "theme": "verbs",
  "description_ar": "أفعال الأنشطة اليومية.",
  "words": [
    { "en": "Wake up", "ar": "يستيقظ", "ipa": "/weɪk ʌp/", "pos": "verb", "example_en": "I wake up at 7.", "example_ar": "أستيقظ في السابعة." },
    { "en": "Sleep", "ar": "ينام", "ipa": "/sliːp/", "pos": "verb", "example_en": "Sleep well.", "example_ar": "نم جيداً." },
    { "en": "Eat", "ar": "يأكل", "ipa": "/iːt/", "pos": "verb", "example_en": "Eat your food.", "example_ar": "كل طعامك." },
    { "en": "Drink", "ar": "يشرب", "ipa": "/drɪŋk/", "pos": "verb", "example_en": "Drink water.", "example_ar": "اشرب الماء." },
    { "en": "Cook", "ar": "يطبخ", "ipa": "/kʊk/", "pos": "verb", "example_en": "Cook dinner.", "example_ar": "اطبخ العشاء." },
    { "en": "Wash", "ar": "يغسل", "ipa": "/wɑːʃ/", "pos": "verb", "example_en": "Wash the dishes.", "example_ar": "اغسل الصحون." },
    { "en": "Clean", "ar": "ينظف", "ipa": "/kliːn/", "pos": "verb", "example_en": "Clean your room.", "example_ar": "نظف غرفتك." },
    { "en": "Brush", "ar": "يفرشي", "ipa": "/brʌʃ/", "pos": "verb", "example_en": "Brush your teeth.", "example_ar": "اغسل أسنانك." },
    { "en": "Get dressed", "ar": "يلبس", "ipa": "/ɡet drest/", "pos": "phrase", "example_en": "Get dressed quickly.", "example_ar": "البس بسرعة." },
    { "en": "Work", "ar": "يعمل", "ipa": "/wɜːrk/", "pos": "verb", "example_en": "I work hard.", "example_ar": "أعمل بجد." },
    { "en": "Study", "ar": "يدرس", "ipa": "/ˈstʌd.i/", "pos": "verb", "example_en": "Study English.", "example_ar": "ادرس الإنجليزية." },
    { "en": "Read", "ar": "يقرأ", "ipa": "/riːd/", "pos": "verb", "example_en": "Read a book.", "example_ar": "اقرأ كتاباً." },
    { "en": "Write", "ar": "يكتب", "ipa": "/raɪt/", "pos": "verb", "example_en": "Write a letter.", "example_ar": "اكتب رسالة." },
    { "en": "Watch", "ar": "يشاهد", "ipa": "/wɑːtʃ/", "pos": "verb", "example_en": "Watch a movie.", "example_ar": "شاهد فيلماً." },
    { "en": "Listen", "ar": "يستمع", "ipa": "/ˈlɪs.ən/", "pos": "verb", "example_en": "Listen to music.", "example_ar": "استمع للموسيقى." },
    { "en": "Play", "ar": "يلعب", "ipa": "/pleɪ/", "pos": "verb", "example_en": "Play with friends.", "example_ar": "العب مع الأصدقاء." },
    { "en": "Buy", "ar": "يشتري", "ipa": "/baɪ/", "pos": "verb", "example_en": "Buy bread.", "example_ar": "اشترِ خبزاً." },
    { "en": "Pay", "ar": "يدفع", "ipa": "/peɪ/", "pos": "verb", "example_en": "Pay the bill.", "example_ar": "ادفع الفاتورة." },
    { "en": "Open", "ar": "يفتح", "ipa": "/ˈoʊ.pən/", "pos": "verb", "example_en": "Open the door.", "example_ar": "افتح الباب." },
    { "en": "Close", "ar": "يغلق", "ipa": "/kloʊz/", "pos": "verb", "example_en": "Close the window.", "example_ar": "أغلق النافذة." },
    { "en": "Start", "ar": "يبدأ", "ipa": "/stɑːrt/", "pos": "verb", "example_en": "Start the engine.", "example_ar": "ابدأ المحرك." },
    { "en": "Finish", "ar": "ينهي", "ipa": "/ˈfɪn.ɪʃ/", "pos": "verb", "example_en": "Finish your work.", "example_ar": "أنهِ عملك." },
    { "en": "Help", "ar": "يساعد", "ipa": "/help/", "pos": "verb", "example_en": "Help me, please.", "example_ar": "ساعدني من فضلك." },
    { "en": "Try", "ar": "يحاول", "ipa": "/traɪ/", "pos": "verb", "example_en": "Try again.", "example_ar": "حاول مرة أخرى." },
    { "en": "Use", "ar": "يستخدم", "ipa": "/juːz/", "pos": "verb", "example_en": "Use the key.", "example_ar": "استخدم المفتاح." }
  ]
}
