{
  "id": "vocab-34",
  "title": "أماكن المدينة",
  "title_en": "City Places",
  "level": "A1",
  "theme": "places",
  "description_ar": "أماكن شائعة في المدينة.",
  "words": [
    { "en": "City", "ar": "مدينة", "ipa": "/ˈsɪt̬.i/", "pos": "noun", "example_en": "Big city.", "example_ar": "مدينة كبيرة." },
    { "en": "Town", "ar": "بلدة", "ipa": "/taʊn/", "pos": "noun", "example_en": "A small town.", "example_ar": "بلدة صغيرة." },
    { "en": "Bank", "ar": "بنك", "ipa": "/bæŋk/", "pos": "noun", "example_en": "Go to the bank.", "example_ar": "اذهب إلى البنك." },
    { "en": "Post office", "ar": "مكتب بريد", "ipa": "/poʊst ˈɑː.fɪs/", "pos": "noun", "example_en": "Send it from the post office.", "example_ar": "أرسلها من مكتب البريد." },
    { "en": "Hospital", "ar": "مستشفى", "ipa": "/ˈhɑː.spɪ.təl/", "pos": "noun", "example_en": "Go to the hospital.", "example_ar": "اذهب إلى المستشفى." },
    { "en": "Pharmacy", "ar": "صيدلية", "ipa": "/ˈfɑːr.mə.si/", "pos": "noun", "example_en": "Visit the pharmacy.", "example_ar": "زر الصيدلية." },
    { "en": "Restaurant", "ar": "مطعم", "ipa": "/ˈres.tər.ɑːnt/", "pos": "noun", "example_en": "An Italian restaurant.", "example_ar": "مطعم إيطالي." },
    { "en": "Cafe", "ar": "مقهى", "ipa": "/kæˈfeɪ/", "pos": "noun", "example_en": "A nice cafe.", "example_ar": "مقهى جميل." },
    { "en": "Supermarket", "ar": "سوبر ماركت", "ipa": "/ˈsuː.pərˌmɑːr.kɪt/", "pos": "noun", "example_en": "Go to the supermarket.", "example_ar": "اذهب للسوبر ماركت." },
    { "en": "Shop", "ar": "متجر", "ipa": "/ʃɑːp/", "pos": "noun", "example_en": "A small shop.", "example_ar": "متجر صغير." },
    { "en": "Mall", "ar": "مول", "ipa": "/mɔːl/", "pos": "noun", "example_en": "Shopping mall.", "example_ar": "مول تسوق." },
    { "en": "Market", "ar": "سوق", "ipa": "/ˈmɑːr.kɪt/", "pos": "noun", "example_en": "Fresh market.", "example_ar": "سوق طازج." },
    { "en": "Park", "ar": "حديقة عامة", "ipa": "/pɑːrk/", "pos": "noun", "example_en": "Walk in the park.", "example_ar": "تمشَّ في الحديقة." },
    { "en": "Museum", "ar": "متحف", "ipa": "/mjuˈziː.əm/", "pos": "noun", "example_en": "Art museum.", "example_ar": "متحف الفن." },
    { "en": "Library", "ar": "مكتبة عامة", "ipa": "/ˈlaɪ.brer.i/", "pos": "noun", "example_en": "Quiet library.", "example_ar": "مكتبة هادئة." },
    { "en": "School", "ar": "مدرسة", "ipa": "/skuːl/", "pos": "noun", "example_en": "A new school.", "example_ar": "مدرسة جديدة." },
    { "en": "Church", "ar": "كنيسة", "ipa": "/tʃɝːtʃ/", "pos": "noun", "example_en": "Old church.", "example_ar": "كنيسة قديمة." },
    { "en": "Mosque", "ar": "مسجد", "ipa": "/mɑːsk/", "pos": "noun", "example_en": "The big mosque.", "example_ar": "المسجد الكبير." },
    { "en": "Stadium", "ar": "ملعب", "ipa": "/ˈsteɪ.di.əm/", "pos": "noun", "example_en": "Football stadium.", "example_ar": "ملعب كرة قدم." },
    { "en": "Cinema", "ar": "سينما", "ipa": "/ˈsɪn.ə.mə/", "pos": "noun", "example_en": "Go to the cinema.", "example_ar": "اذهب للسينما." },
    { "en": "Hotel", "ar": "فندق", "ipa": "/hoʊˈtel/", "pos": "noun", "example_en": "Stay at a hotel.", "example_ar": "أقم في فندق." },
    { "en": "Bridge", "ar": "جسر", "ipa": "/brɪdʒ/", "pos": "noun", "example_en": "A long bridge.", "example_ar": "جسر طويل." },
    { "en": "Square", "ar": "ميدان", "ipa": "/skwer/", "pos": "noun", "example_en": "Main square.", "example_ar": "الميدان الرئيسي." },
    { "en": "Bakery", "ar": "مخبز", "ipa": "/ˈbeɪ.kər.i/", "pos": "noun", "example_en": "Fresh bakery.", "example_ar": "مخبز طازج." },
    { "en": "Gas station", "ar": "محطة بنزين", "ipa": "/ɡæs ˈsteɪ.ʃən/", "pos": "noun", "example_en": "Stop at the gas station.", "example_ar": "توقف عند محطة البنزين." }
  ]
}
