{
  "id": "vocab-17",
  "title": "غرف المنزل",
  "title_en": "House Rooms",
  "level": "A1",
  "theme": "home",
  "description_ar": "أجزاء وغرف البيت.",
  "words": [
    { "en": "House", "ar": "بيت", "ipa": "/haʊs/", "pos": "noun", "example_en": "A big house.", "example_ar": "بيت كبير." },
    { "en": "Home", "ar": "منزل", "ipa": "/hoʊm/", "pos": "noun", "example_en": "I'm going home.", "example_ar": "ذاهب إلى المنزل." },
    { "en": "Apartment", "ar": "شقة", "ipa": "/əˈpɑːrt.mənt/", "pos": "noun", "example_en": "A small apartment.", "example_ar": "شقة صغيرة." },
    { "en": "Room", "ar": "غرفة", "ipa": "/ruːm/", "pos": "noun", "example_en": "My room is clean.", "example_ar": "غرفتي نظيفة." },
    { "en": "Bedroom", "ar": "غرفة نوم", "ipa": "/ˈbed.ruːm/", "pos": "noun", "example_en": "My bedroom.", "example_ar": "غرفة نومي." },
    { "en": "Living room", "ar": "غرفة المعيشة", "ipa": "/ˈlɪv.ɪŋ ruːm/", "pos": "noun", "example_en": "A cozy living room.", "example_ar": "غرفة معيشة مريحة." },
    { "en": "Kitchen", "ar": "مطبخ", "ipa": "/ˈkɪtʃ.ɪn/", "pos": "noun", "example_en": "A modern kitchen.", "example_ar": "مطبخ حديث." },
    { "en": "Bathroom", "ar": "حمام", "ipa": "/ˈbæθ.ruːm/", "pos": "noun", "example_en": "The bathroom is upstairs.", "example_ar": "الحمام في الأعلى." },
    { "en": "Dining room", "ar": "غرفة طعام", "ipa": "/ˈdaɪ.nɪŋ ruːm/", "pos": "noun", "example_en": "Family dining room.", "example_ar": "غرفة طعام عائلية." },
    { "en": "Garage", "ar": "كراج", "ipa": "/ɡəˈrɑːʒ/", "pos": "noun", "example_en": "Car in the garage.", "example_ar": "السيارة في الكراج." },
    { "en": "Garden", "ar": "حديقة", "ipa": "/ˈɡɑːr.dən/", "pos": "noun", "example_en": "A beautiful garden.", "example_ar": "حديقة جميلة." },
    { "en": "Yard", "ar": "فناء", "ipa": "/jɑːrd/", "pos": "noun", "example_en": "Kids play in the yard.", "example_ar": "الأطفال يلعبون في الفناء." },
    { "en": "Balcony", "ar": "شرفة", "ipa": "/ˈbæl.kə.ni/", "pos": "noun", "example_en": "A small balcony.", "example_ar": "شرفة صغيرة." },
    { "en": "Roof", "ar": "سقف", "ipa": "/ruːf/", "pos": "noun", "example_en": "Red roof.", "example_ar": "سقف أحمر." },
    { "en": "Floor", "ar": "أرضية / طابق", "ipa": "/flɔːr/", "pos": "noun", "example_en": "Clean floor.", "example_ar": "أرضية نظيفة." },
    { "en": "Wall", "ar": "جدار", "ipa": "/wɔːl/", "pos": "noun", "example_en": "White walls.", "example_ar": "جدران بيضاء." },
    { "en": "Door", "ar": "باب", "ipa": "/dɔːr/", "pos": "noun", "example_en": "Open the door.", "example_ar": "افتح الباب." },
    { "en": "Window", "ar": "نافذة", "ipa": "/ˈwɪn.doʊ/", "pos": "noun", "example_en": "Big windows.", "example_ar": "نوافذ كبيرة." },
    { "en": "Stairs", "ar": "درج", "ipa": "/sterz/", "pos": "noun", "example_en": "Climb the stairs.", "example_ar": "اصعد الدرج." },
    { "en": "Ceiling", "ar": "سقف", "ipa": "/ˈsiː.lɪŋ/", "pos": "noun", "example_en": "High ceiling.", "example_ar": "سقف عالٍ." },
    { "en": "Hallway", "ar": "ممر", "ipa": "/ˈhɔːl.weɪ/", "pos": "noun", "example_en": "A narrow hallway.", "example_ar": "ممر ضيق." },
    { "en": "Basement", "ar": "قبو", "ipa": "/ˈbeɪs.mənt/", "pos": "noun", "example_en": "The basement is dark.", "example_ar": "القبو مظلم." },
    { "en": "Attic", "ar": "علية", "ipa": "/ˈæt̬.ɪk/", "pos": "noun", "example_en": "Old toys in the attic.", "example_ar": "ألعاب قديمة في العلية." },
    { "en": "Office (home)", "ar": "مكتب منزلي", "ipa": "/ˈɑː.fɪs/", "pos": "noun", "example_en": "My home office.", "example_ar": "مكتبي المنزلي." },
    { "en": "Laundry room", "ar": "غرفة الغسيل", "ipa": "/ˈlɔːn.dri ruːm/", "pos": "noun", "example_en": "Laundry room is downstairs.", "example_ar": "غرفة الغسيل في الأسفل." }
  ]
}
