{
  "id": "vocab-30",
  "title": "الطقس والفصول",
  "title_en": "Weather & Seasons",
  "level": "A1",
  "theme": "weather",
  "description_ar": "الطقس والظواهر الجوية والفصول.",
  "words": [
    { "en": "Weather", "ar": "طقس", "ipa": "/ˈweð.ər/", "pos": "noun", "example_en": "Nice weather.", "example_ar": "طقس جميل." },
    { "en": "Sunny", "ar": "مشمس", "ipa": "/ˈsʌn.i/", "pos": "adjective", "example_en": "A sunny day.", "example_ar": "يوم مشمس." },
    { "en": "Cloudy", "ar": "غائم", "ipa": "/ˈklaʊ.di/", "pos": "adjective", "example_en": "It's cloudy.", "example_ar": "الجو غائم." },
    { "en": "Rainy", "ar": "ممطر", "ipa": "/ˈreɪ.ni/", "pos": "adjective", "example_en": "A rainy night.", "example_ar": "ليلة ممطرة." },
    { "en": "Windy", "ar": "عاصف", "ipa": "/ˈwɪn.di/", "pos": "adjective", "example_en": "A windy day.", "example_ar": "يوم عاصف." },
    { "en": "Snowy", "ar": "مثلج", "ipa": "/ˈsnoʊ.i/", "pos": "adjective", "example_en": "A snowy morning.", "example_ar": "صباح مثلج." },
    { "en": "Foggy", "ar": "ضبابي", "ipa": "/ˈfɔː.ɡi/", "pos": "adjective", "example_en": "Foggy roads.", "example_ar": "طرق ضبابية." },
    { "en": "Stormy", "ar": "عاصف", "ipa": "/ˈstɔːr.mi/", "pos": "adjective", "example_en": "A stormy night.", "example_ar": "ليلة عاصفة." },
    { "en": "Sun", "ar": "شمس", "ipa": "/sʌn/", "pos": "noun", "example_en": "The sun is bright.", "example_ar": "الشمس ساطعة." },
    { "en": "Cloud", "ar": "غيمة", "ipa": "/klaʊd/", "pos": "noun", "example_en": "White clouds.", "example_ar": "غيوم بيضاء." },
    { "en": "Rain", "ar": "مطر", "ipa": "/reɪn/", "pos": "noun", "example_en": "Heavy rain.", "example_ar": "مطر غزير." },
    { "en": "Snow", "ar": "ثلج", "ipa": "/snoʊ/", "pos": "noun", "example_en": "Fresh snow.", "example_ar": "ثلج طازج." },
    { "en": "Wind", "ar": "ريح", "ipa": "/wɪnd/", "pos": "noun", "example_en": "Strong wind.", "example_ar": "ريح قوية." },
    { "en": "Storm", "ar": "عاصفة", "ipa": "/stɔːrm/", "pos": "noun", "example_en": "A big storm.", "example_ar": "عاصفة كبيرة." },
    { "en": "Thunder", "ar": "رعد", "ipa": "/ˈθʌn.dər/", "pos": "noun", "example_en": "Loud thunder.", "example_ar": "رعد عالٍ." },
    { "en": "Lightning", "ar": "برق", "ipa": "/ˈlaɪt.nɪŋ/", "pos": "noun", "example_en": "Bright lightning.", "example_ar": "برق ساطع." },
    { "en": "Temperature", "ar": "درجة حرارة", "ipa": "/ˈtem.prə.tʃər/", "pos": "noun", "example_en": "High temperature.", "example_ar": "درجة حرارة عالية." },
    { "en": "Hot", "ar": "حار", "ipa": "/hɑːt/", "pos": "adjective", "example_en": "It's hot today.", "example_ar": "الجو حار اليوم." },
    { "en": "Warm", "ar": "دافئ", "ipa": "/wɔːrm/", "pos": "adjective", "example_en": "Warm weather.", "example_ar": "طقس دافئ." },
    { "en": "Cool", "ar": "بارد قليلاً", "ipa": "/kuːl/", "pos": "adjective", "example_en": "Cool breeze.", "example_ar": "نسيم بارد." },
    { "en": "Cold", "ar": "بارد", "ipa": "/koʊld/", "pos": "adjective", "example_en": "It's cold.", "example_ar": "الجو بارد." },
    { "en": "Spring", "ar": "ربيع", "ipa": "/sprɪŋ/", "pos": "noun", "example_en": "Spring flowers.", "example_ar": "أزهار الربيع." },
    { "en": "Summer", "ar": "صيف", "ipa": "/ˈsʌm.ər/", "pos": "noun", "example_en": "Hot summer.", "example_ar": "صيف حار." },
    { "en": "Autumn", "ar": "خريف", "ipa": "/ˈɔː.t̬əm/", "pos": "noun", "example_en": "Autumn leaves.", "example_ar": "أوراق الخريف." },
    { "en": "Winter", "ar": "شتاء", "ipa": "/ˈwɪn.t̬ər/", "pos": "noun", "example_en": "Cold winter.", "example_ar": "شتاء بارد." }
  ]
}
